ifsc,bank_id,branch,address,city,district,state,bank_name
IDIB000E041,18,ENCHAKKAL,"TC 42/927/7 ENCHAKKAL, VALLAKKADAVU, THIRUVANATHAPURAM DIST, KERALA, PIN 695008",THIRUVANANTHAPURAM,THIRUVANANTHAPURAM,KERALA,INDIAN BANK
IDIB000E042,18,EM BYPASS,"EM BYPASS BRANCH, 38, BAGHAJATIN - STATION ROAD, KOLKATA, WEST BENGAL, PIN - 700 086",KOLKATA,KOLKATA,WEST BENGAL,INDIAN BANK
IDIB000E043,18,ELAMAKKARA,"NEAR SAFA BAKERY, KEERTHY NAGAR, DESHABIMANI ROAD, ELAMAKKARA, ERNAKULAM DIST, KERALA, PIN-682026",KOCHI,ERNAKULAM,KERALA,INDIAN BANK
IDIB000E044,18,EDAPALAYAM,"318-7 THIRUVALLUVAR HIGH ROAD, EDAPALAYAM, TIRUVALLVAR DIST, TAMILNADU, PIN-600052",RED HILLS,THIRUVALLUR,TAMIL NADU,INDIAN BANK
IDIB000E045,18,E B COLONY  THANJAVUR,"146, AROKIYA NAGAR, 2ND STREET EB COLONY, NANJIKOTTAI ROAD, THANJAVUR, THANJAVUR DIST, TAMILNADU, PIN-613006",THANJAVUR,THANJAVUR,TAMIL NADU,INDIAN BANK
IDIB000F001,18,FARIDABAD,"A-3/3, NEHRU GROUND FARIDABAD (N I T)FARIDABAD 121001",FARIDABAD,FARIDABAD,HARYANA,INDIAN BANK
IDIB000F002,18,FATEH GUNJ,"MAIN ROAD,FATEHGUNJ, VADODARA,PIN 390002",VADODARA,VADODARA,GUJARAT,INDIAN BANK
IDIB000F003,18,FAIRLANDS MAIN ROAD,FAIRLANDS MAIN ROADSALEM TAMIL NADU636016,SALEM,SALEM,TAMIL NADU,INDIAN BANK
IDIB000F004,18,FALAKNUMA,"19-3-1076, SHAMSHEERGUNJFALAKNUMAHYDERABAD 500253",HYDERABAD,HYDERABAD URBAN,ANDHRA PRADESH,INDIAN BANK
IDIB000F005,18,FAIRLIE PLACE,"17, N S ROAD, FAIRLIE PLACE, EASTERN RAILWAY HQ BUILDING, KOLKATA, WEST BENGAL - 700001",KOLKATA,KOLKATA,WEST BENGAL,INDIAN BANK
IDIB000F006,18,FAIZABAD,"IST FLOOR, ALKA TOWER  RIKAB GANJ,  NIYAWA ROAD,  FAIZABAD 224001",FAIZABAD,FAIZABAD,UTTAR PRADESH,INDIAN BANK
IDIB000F007,18,FARIDKOT,JUBILEE CINEMA CHOWK  IST FLOOR  JUBILEE TOWER  FARIDKOT 151203,FARIDKOT,FARIDKOT,PUNJAB,INDIAN BANK
IDIB000F008,18,FIROZABAD,"SECTOR-1/346,  SUHAG NAGAR  FIROZABAD 283203",FIROZABAD,FIROZABAD,UTTAR PRADESH,INDIAN BANK
IDIB000F009,18,FATEHGARH NAUBAD,FATEHGARH NAUBADC/O GURU KASHI UNIVERSITYSARDOOLGARH ROADTALWANDI SABO BATHINDA PUNJAB PIN-151302,TALWANDI SABO,BATHINDA,PUNJAB,INDIAN BANK
IDIB000F010,18,FATEHABAD,"SHOP 569, OPP TO STATE BANK OF PATIALA, G T ROAD, FATEHABAD DIST, HARYANA, PIN-125050",FATEHABAD,FATEHABAD,HARYANA,INDIAN BANK
IDIB000F011,18,FATEHPUR,"166/149, AABU NAGAR (NORTH), G T ROAD, DOUBLE TOWER BUILDING, FATEHPUR, UP, PIN - 212601",FATEHPUR,FATEHPUR,UTTAR PRADESH,INDIAN BANK
IDIB000F012,18,FOYSAGAR ROAD  AJMER,"NEAR BSNL TELEPHONE EXCHANGE, KIRTI NAGAR, FOY SAGAR ROAD, AJMER, RAJASTHAN, PIN - 305001",AJMER,AJMER,RAJASTHAN,INDIAN BANK
IDIB000F013,18,FARRUKHABAD,"UGF 6/123(6/105-106) APARAJITHA PLAZA, BARHPUR, FARRUKHABAD, UP, PIN-209625",FARRUKHABAD FATEHGARH,FARRUKHABAD,UTTAR PRADESH,INDIAN BANK
IDIB000F014,18,FEROZEPUR,"RING ROAD, OUTSIDE BAGDADI GATE, NEAR SAYIAN WALI KOTHI, FEROZEPUR, PUNJAB, PIN-152002",FIROZPUR,FEROZPUR,PUNJAB,INDIAN BANK
IDIB000G001,18,GANDHINAGAR,"PB NO. 551,26-2-36B ANDHRARATHNA ROADVIJAYAWADA520003",VIJAYAWADA,KRISHNA,ANDHRA PRADESH,INDIAN BANK
IDIB000G002,18,GANDRAYI,PANCHAYAT ROAD GANDRAYI KRISHNA DT 521435,GANDRAYI,KRISHNA,ANDHRA PRADESH,INDIAN BANK
IDIB000G003,18,GANESH CHANDRA AVENUE,"1, GANESH CHANDRA AVENUE  KOLKATA. PIN CODE.700 013.",KOLKATA,KOLKATA,WEST BENGAL,INDIAN BANK
IDIB000G004,18,GANGAVALLI,ATTUR MAIN ROAD GANGAVALLI TALUK SALEM 636105,GANGAVALLI,SALEM,TAMIL NADU,INDIAN BANK
IDIB000G005,18,GARIAHAT,14/7  GARIAHAT ROADKOLKATAWEST BENGAL700019,KOLKATA,KOLKATA,WEST BENGAL,INDIAN BANK
IDIB000G006,18,GUWAHATI,"S.S.ROAD, LAKHTOKIA GUWAHATI, KAMRUP DIST. ASSAM..781 001",GUWAHATI,KAMRUP,ASSAM,INDIAN BANK
IDIB000G007,18,GHAZIABAD,"NO.3, NAVYUG MARKET, GHAZIABAD 201001",GHAZIABAD,GHAZIABAD,UTTAR PRADESH,INDIAN BANK
IDIB000G008,18,GHATKOPAR,SMEET APARTMENTSUPASHRAYA LANE GHATKOPAR (EAST) 400077,MUMBAI,GREATER MUMBAI,MAHARASHTRA,INDIAN BANK
IDIB000G009,18,GOBICHETTIPALAYAM,3 SLAUGHTER HOUSE ST GOBICHETTIPALAYAM 638452,GOBICHETTIPALAYAM,ERODE,TAMIL NADU,INDIAN BANK
IDIB000G010,18,GOKAVARAM,7/123 MAIN ROAD 533286,GOKAVARAM,EAST GODAVARI,ANDHRA PRADESH,INDIAN BANK
IDIB000G011,18,GOLDEN ROCK,"MATHURAM COMPLEXPONMALAI PATTI, GOLDEN ROCKTRICHY620004",TIRUCHIRAPPALLI,TIRUCHIORAPPALLI,TAMIL NADU,INDIAN BANK
IDIB000G012,18,GOPALAPURAM,4-30 MAIN ROAD GOPALAPURAM 533274,GOPALAPURAM,EAST GODAVARI,ANDHRA PRADESH,INDIAN BANK
IDIB000G013,18,GOPALPUR,MAIN ROAD GOPALPUR GANJAM 761002,GOPALPUR,GANJAM,ODISHA,INDIAN BANK
IDIB000G014,18,GOREGAON,"A WING, ASHOKA SUPER MARKETS V ROAD - AAREY ROAD JN.GOREGAON (W)400062",MUMBAI,GREATER MUMBAI,MAHARASHTRA,INDIAN BANK
IDIB000G015,18,GOVERNORPET,P.B.NO.344MUDDA SUBBIAH STREETGOVERNORPET520002,VIJAYAWADA,KRISHNA,ANDHRA PRADESH,INDIAN BANK
IDIB000G016,18,GREATER KAILASH,13 COMMUNITY CENTRE ZAMRUDPURGREATER KAILASH-I110048,DELHI,NEW DELHI,DELHI,INDIAN BANK
IDIB000G017,18,GUDIVADA,P.B.NO.12LAKSHMI COMPLEX MAIN ROADGUDIVADA  521301,GUDIVADA,KRISHNA,ANDHRA PRADESH,INDIAN BANK
IDIB000G018,18,GUDIYATHAM,27 RAJAJI STREET GUDIYATHAM 632602,GUDIYATHAM,VELLORE,TAMIL NADU,INDIAN BANK
IDIB000G019,18,GUDUVANCHERI,"5, G S T ROAD, GUDUVANCHERY, KANCHEEPURAM DIST.  PIN 603202",GUDUVANCHERI,KANCHEEPURAM,TAMIL NADU,INDIAN BANK
IDIB000G020,18,GUINDY,"PB NO.3171, SIDCO BUILDING, GST ROAD, GUINDY, CHENNAI 600 032",CHENNAI,CHENNAI,TAMIL NADU,INDIAN BANK
IDIB000G021,18,GUJJANAGUNDLA,1-2-1 RING ROAD GUJJANGUNDLA 522006,GUNTUR,GUNTUR,ANDHRA PRADESH,INDIAN BANK
IDIB000G022,18,GULBARGA,PLOT NO 5 & 76 IST FLOOR SUPER MARKET GULBARGA 585101,GULBARGA,GULBERGA,KARNATAKA,INDIAN BANK
IDIB000G023,18,GUNTUR,"PB NO. LAKSHMI MANSION, KOTHAPET, GUNTUR 522001, AP, PH:",GUNTUR,GUNTUR,ANDHRA PRADESH,INDIAN BANK
IDIB000G024,18,GUNUPUR,MAIN ROAD GUNUPUR RAYAGADA ORISSA 765022,GUNUPUR,RAYAGADA,ODISHA,INDIAN BANK
IDIB000G025,18,GWALIOR,752  INDERGANJ SQUARE LASHKARGWALIORMADHYA PRADESH474009,GWALIOR,GWALIOR,MADHYA PRADESH,INDIAN BANK
IDIB000G026,18,GURGAON,GURDWARA ROAD  GURGAONGURGAON122001,GURGAON,GURGAON,HARYANA,INDIAN BANK
IDIB000G027,18,GODHRA,NEAR M&M MEHTA HG SCH BAHARPURA GODHRA PANCH MAHALS 389001,GODHRA,PANCHMAHALS,GUJARAT,INDIAN BANK
IDIB000G028,18,GAYA,GOLPATHAR THAKUR BARI TEKARI ROAD GAYA 823001,GAYA,GAYA,BIHAR,INDIAN BANK
IDIB000G029,18,GOLLAPALLI,BANK STREET GOLLAPALLI 521111,GOLLAPALLI,KRISHNA,ANDHRA PRADESH,INDIAN BANK
IDIB000G030,18,GARABANDA,MAIN ROAD GARABANDHA 761215,GARABANDHA,GAJAPATI,ODISHA,INDIAN BANK
IDIB000G031,18,GANGADHARANELLORE,BANK STREET GANGADHARANELLORE CHITTOOR 517125,GANGADHARNALLORE,CHITTOR,ANDHRA PRADESH,INDIAN BANK
IDIB000G032,18,GHONSA,GHONSA VILLAGE WANI TALUKA GHONSA YEOTMAL 445314,GHONSA,YAVATMAL,MAHARASHTRA,INDIAN BANK
IDIB000G033,18,GOPANAHALLI,GOPPENAHALLI HODIKERE DAVANGERE 577215,GOPANAHALLI,DAVANAGARE,KARNATAKA,INDIAN BANK
IDIB000G034,18,GREAMSPET,3-1-34 VELLORE ROAD GREAMSPET 517002,CHITTOOR,CHITTOR,ANDHRA PRADESH,INDIAN BANK
IDIB000G035,18,GODOWLIA,D - 48/122  MISSIRPOKHRAGODOWLIA VARANASI  221001,VARANASI,VARANASI,UTTAR PRADESH,INDIAN BANK
IDIB000G036,18,GOVINDANAGARAM,1/77 MAIN STREET GOVINDANAGARAM THENI 625517,GOVINDANAGARAM,THENI,TAMIL NADU,INDIAN BANK
IDIB000G037,18,G P KOOTU ROAD,3/95 HARUR-SALEM MAIN ROAD GOPINATHAM PATTI KOOTU ROAD PARAYAPATTI PUDUR PO DHARMAPURI 636903,PARAIYAPATTI PUDUR,DHARMAPURI,TAMIL NADU,INDIAN BANK
IDIB000G038,18,GESALATHAKALAPALLI,2/79 GESALATHAKKALAPALLI KARIMNAGAR 505187,GESALATHAKALAPALLI,KARIM NAGAR,ANDHRA PRADESH,INDIAN BANK
IDIB000G039,18,GUDIPATIPALLI,242 MAIN STREET GUDIPATIPALLI PRAKASAM DT 523228,GUDIPATIPALLI,PRAKASAM,ANDHRA PRADESH,INDIAN BANK
IDIB000G040,18,GAROUL,GAROUL VILLAGE PO GAROULI VIA PUTAI DARBHANGA 847423,GAROUL,DARBHANGA,BIHAR,INDIAN BANK
IDIB000G041,18,GODA,GODA (VIA) BORIKINA JAGATSINGHPUR 754110,GODA,JAGATSINGHPUR,ODISHA,INDIAN BANK
IDIB000G043,18,GOSSAINSATRA,GOSSAINSATRA ADHAR SATRA GOLAGHAT 785621,GOSSAINSATRA,GOLAGHAT,ASSAM,INDIAN BANK
IDIB000G045,18,GURUVAYOOR,10/340 EAST NADAGURUVAYOOR680101,GURUVAYUR,TRISSUR,KERALA,INDIAN BANK
IDIB000G046,18,GUMMUDIPOONDI,"90,G N T ROAD, GUMMIDPOONDI TIRUVALLUR DT 601201",GUMMIDIPUNDI,TIRUVALLUR,TAMIL NADU,INDIAN BANK
IDIB000G047,18,GANDHI NAGAR (GUJ),BLOCK 316SECTOR 16GANDHINAGAR382016,GANDHINAGAR,GANDHINAGAR,GUJARAT,INDIAN BANK
IDIB000G048,18,GAJALANAICKENPATTI,GAJALANAICKENPATTI KANDILI POST VELLORE 635901,KANDILI,VELLORE,TAMIL NADU,INDIAN BANK
IDIB000G049,18,GANGADIPALEM,MAIN ROAD GANGADIPALEM 522264,GANGADIPALEM,GUNTUR,ANDHRA PRADESH,INDIAN BANK
IDIB000G052,18,GUGAI,"598, TRICHY MAIN ROAD S.K.COMPLEXGUGAI636006",SALEM,SALEM,TAMIL NADU,INDIAN BANK
IDIB000G053,18,PATNAM BAZAAR,22-2-95CLOTH BAZAARGUNTUR  ANDHRA PRADESH522003,GUNTUR,GUNTUR,ANDHRA PRADESH,INDIAN BANK
IDIB000G057,18,GOLAGHAT,MAIN ROADGOLAGHAT 785621,GOLAGHAT,GOLAGHAT,ASSAM,INDIAN BANK
IDIB000G058,18,GREATER NOIDA,"S-7, I FLOOR, GAMMA SHOPPING MALL, SECTOR GAMMA, GREATER NOIDA 201301",NOIDA,GAUTAM BODDA NAGAR,UTTAR PRADESH,INDIAN BANK
IDIB000G059,18,GANAPATHY,JAYASANTHI TOWERS1373-A SATHY ROADCOIMBATORE641006,COIMBATORE,COIMBOTORE,TAMIL NADU,INDIAN BANK
IDIB000G060,18,GACHI BOWLI,FLAT 12-16 SY NO 93 INDIRA NAGARMAIN ROADGACHI BOWLI HYDERABAD500008,HYDERABAD,HYDERABAD URBAN,ANDHRA PRADESH,INDIAN BANK
IDIB000G061,18,G S ROAD,"SIKARIA COMPOUND, G S ROAD, DISPUR, GUWAHATHI 781005",GUWAHATI,KAMRUP,ASSAM,INDIAN BANK
IDIB000G062,18,GINGEE,"S.NO.93, TIRUVANNAMALAI ROAD, GINGEE ┬û 604202.",GINGEE,VILLUPURAM,TAMIL NADU,INDIAN BANK
IDIB000G063,18,GORAKHPUR,16 C BANK ROAD GORAKHPUR 273 001,GORAKHPUR,GORAKPUR,UTTAR PRADESH,INDIAN BANK
IDIB000G064,18,GOTRI ROAD (BARODA),"1, SUJATA SOCIETY, HARINAGAR CHAR RASTA, GOTRI ROAD, VADODARA ┬û 390021",VADODARA,VADODARA,GUJARAT,INDIAN BANK
IDIB000G065,18,GAJUWAKA,"D.NO.2-1-16, RAMNAGAR, NH-5, VV KRISHNA PLAZA, OPP.BHPV, MINDHI ROAD, GAJUWAKA, VISHAKAPATNAM ┬û 530 012.",GAJUWAKA,VISHAKAPATNAM,ANDHRA PRADESH,INDIAN BANK
IDIB000G066,18,GANGTOK,"M G MARG, NEW MARKET, GANGTOK ┬û 737 101",GANGTOK,EAST SIKKIM,SIKKIM,INDIAN BANK
IDIB000G067,18,GANGA NAGAR,"PLOT NO.3, SHAH TOWERS, (NEAR SUKHADYA CIRCLE), SRI GANGA NAGAR  335 001",GANGANAGAR,GANGANAGAR,RAJASTHAN,INDIAN BANK
IDIB000G068,18,G N B ROAD,"I FLOOR, SEUJEE ENCLAVE G N B ROAD CHANDMARI TRAFFIC POINT GUWAHATI 781003",GUWAHATI,KAMRUP,ASSAM,INDIAN BANK
IDIB000G069,18,GOVT BUSINESS SER. BR CHENNAI,"SICCI BUILDING NO. 6, ESPLANADE ROAD CHENNAI 600108",CHENNAI,CHENNAI,TAMIL NADU,INDIAN BANK
IDIB000G070,18,GOVT. VELLORE MEDICAL COLLEGE,GOVT. VELLORE MEDICAL COLLEGE ADUKKAMBARAI VELLORE 632011,VELLORE,VELLORE,TAMIL NADU,INDIAN BANK
IDIB000G071,18,GARIA,"217, GARIA MAIN ROAD GARIA KOLKATTA 700084",KOLKATA,KOLKATA,WEST BENGAL,INDIAN BANK
IDIB000G072,18,GORAYA,G T ROAD GORAYA JALANDHAR 144409,GORAYA,JALANDHAR,PUNJAB,INDIAN BANK
IDIB000G073,18,GOLMURI ROAD,TEE KAY COMPLEX NEAR TIN PLATE CO. GATE GOLMURI GOLMURI JAMSHEDPUR 831001,JAMSHEDPUR,PASCHIMI SINGHBHUM,JHARKHAND,INDIAN BANK
IDIB000G074,18,GALSI,"DUTTA MARKET, GALSI - 713406",GALSI,BARDHAMAN,WEST BENGAL,INDIAN BANK
IDIB000G075,18,GANNAVARAM,"DOOR NO 2/200, VENUS STREET, SRINAGAR COLONY, GANNAVARAM  521101",GANNAVARAM,KRISHNA,ANDHRA PRADESH,INDIAN BANK
IDIB000G076,18,GURUNANAK NAGAR,"DOOR NO.59A-B-15 PLOT NO.110 4TH LANE, TEACHERS COLONY GURUNANAK  NAGAR VIJAYAWADA-520008",VIJAYAWADA,KRISHNA,ANDHRA PRADESH,INDIAN BANK
IDIB000G077,18,GURKHA BASTI,"AIRPORT ROAD, GURKHA BASTI, KUNJABAN, WEST TRIPURA, TRIPURA 799006. .",KUNJAVAN,WEST TRIPURA,TRIPURA,INDIAN BANK
IDIB000G078,18,GUJRANWALA TOWN,A-54GUJRANWALA TOWN PART - I NEW DELHI 110009,DELHI,DELHI,DELHI,INDIAN BANK
IDIB000G079,18,G N CHETTY ROAD,"119, G N CHETTY ROAD, T, NAGAR, CHENNAI 600017",CHENNAI,CHENNAI,TAMIL NADU,INDIAN BANK
IDIB000G080,18,GYANPUR,"OLD A.R.T.O OFFICE, PATEL NAGAR, GYANPUR, SRN BHADOHI ,UTTAR PRADESH - 221304",GYANPUR,SANT RAVIDAS NAGAR,UTTAR PRADESH,INDIAN BANK
IDIB000G081,18,GUDUR,"13/92,RAJA STREET,GUDUR",GUDUR,NELLORE,ANDHRA PRADESH,INDIAN BANK
IDIB000G082,18,GGS INDRAPRASTHA UNIVERSITY DWARKA,G.G.S. I.P. UNIVERSITYSECTOR - 16CDWARKA,DELHI,DELHI,DELHI,INDIAN BANK
IDIB000G083,18,GOMTI NAGAR,2/139  VIJAY KHAND  GOMTI NAGAR LUCKNOW 226010,LUCKNOW,LUCKNOW,UTTAR PRADESH,INDIAN BANK
IDIB000G084,18,GHAZIPUR,PHOOLANPUR RAILWAY CROSSING  PHOOLANPUR  GHAZIPUR 233001,GHAZIPUR,GHAZIPUR,UTTAR PRADESH,INDIAN BANK
IDIB000G085,18,GITAM UNIVERSITY,1 ST FLOOR  NIRMAN BHAVAN  GITAM UNIVERSITY CAMPUS  RUSHIKONDA 530045,VISAKHAPATNAM,ANDHRA PRADESH,ANDHRA PRADESH,INDIAN BANK
IDIB000G086,18,GANAPATHI AGRAHARAM,"6-50/1,PILLAIYAR KOIL ST,GANAPATHI AGRAHARAM",GANAPATHY AGRAHARAM,THANJAVUR,TAMIL NADU,INDIAN BANK
IDIB000G087,18,GONDA,CP -108  SAURABH COMPLEX  CIRCULAR ROAD  AWAS VIKAS COLONY  GONDA 271002,GONDA,GONDA,UTTAR PRADESH,INDIAN BANK
IDIB000G088,18,GIRIDIH,KALI MANDA ROAD  GIRIDIH 815301,GIRIDIH,GIRIDIH,JHARKHAND,INDIAN BANK
IDIB000G089,18,GUMLA,"1ST FLOOR,  SARASWATI MEDICAL HALL  NEAR TOWER CHOWK  MAIN ROAD,GUMLA 835207",GUMLA,GUMLA,JHARKHAND,INDIAN BANK
IDIB000G090,18,GOPIGANJ,PHOOL BAGHGYANPUR ROADGOPIGANJ S.R.N. BHADOHI  UTTAR PRADESH  PIN-221303,GOPIGANJ,SANT RAVIDAS NAGAR,UTTAR PRADESH,INDIAN BANK
IDIB000G091,18,GANDHIDHAM,PLOT NO 6SECTOR 1-AGANDHIDHAM DISTRICT KUTCH  GUJARAT-,GANDHIDHAM,KACHCHH,GUJARAT,INDIAN BANK
IDIB000G092,18,GERIGEPALLI,52GERIGAPALLIGERIGAPALLISALAMARATHUPATTI  KRISHNAGIRI TAMIL NADU -635304,KRISHNAGIRI,KRISHNAGIRI,TAMIL NADU,INDIAN BANK
IDIB000G093,18,GANNERUVARAM,"6-66/137/1, MAIN ROAD, NEAR AYURVEDIC HOSPITAL, GANNERUVARAM, BEJJANAKI MANDAL, KARIMNAGAR, ANDHRA PRADESH",KARIMNAGAR,KARIMNAGAR,ANDHRA PRADESH,INDIAN BANK
IDIB000G096,18,GITAM UNIVERSITY CAMPUS,"GITAM UNIVERSITY CAMPUS,RUDRARAM VILLAGE, PATANCHERU MANDAL, MEDAK, ANDRA PRADESH",MEDAK,MEDAK,ANDHRA PRADESH,INDIAN BANK
IDIB000G097,18,GADAG,"SHRI SAI COMPLEX, PLOT NO.1, SEVALAL NAGAR, KALASAPUR ROAD, GADAG, KARNATAKA, PIN - 582101",GADAG,GADAG,KARNATAKA,INDIAN BANK
IDIB000G098,18,GOPALAPATNAM,"11-7 TO 11, MAIN ROAD, OPP. RAMALAYAM, GOPALAPATNAM, VISAKHAPATNAM DIST, ANDHRA PRADESH, PIN - 530027",VISHAKHAPATNAM,VISHAKHAPATNAM,ANDHRA PRADESH,INDIAN BANK
IDIB000G099,18,GANGARAM,"GANGARAM VILLAGE,KOTHANGUDA MANDAL,WARANGAL DIST,ANDHRA PRADESH,PIN 506002",GANGARAM,WARANGAL,ANDHRA PRADESH,INDIAN BANK
IDIB000G100,18,GUDDIMALKAPUR,"GUDDIMALKAPUR,HUNWADA MANDAL,MAHABOOBNAGAR DIST,ANDHRA PRADESH,PIN 509001",GUDDIMALKAPUR,MAHBUBNAGAR,ANDHRA PRADESH,INDIAN BANK
IDIB000G101,18,GAURA BAGANHAWA,"GAURA BAGANHAWA, BLOCK GANSARI, TAHSIL TULSIPUR, BALRAMPUR DIST, UTTAR PRADESH, PIN - 271604",BALRAMPUR,BALRAMPUR,UTTAR PRADESH,INDIAN BANK
IDIB000G102,18,GOLIA,"GRAM PANCHAYAT BUILDING,GOLIA,GANJAM DIST,ORISSA,PIN 761 118",GOLIA,GANJAM,ODISHA,INDIAN BANK
IDIB000G103,18,GURDASPUR,"22,IMPROVEMENT TRUST,G T ROAD,GURDASPUR,GURDASPUR DIST,PUNJAB,PIN 143 521",GURDASPUR,GURDASPUR,PUNJAB,INDIAN BANK
IDIB000G104,18,GOHANA,"648/5 OPP TO VETERINARY HOSPITAL, CHOTU RAM CHOWK, GOHANA, SONEPAT DIST, HARYANA, PIN-131301",GOHANA,SONIPAT,HARYANA,INDIAN BANK
IDIB000G105,18,GOREGAON EAST,"SHOP NO 8 TO 12 CORPORATE AVENUE PLOT NO 488/1, SONAWALA MAIN ROAD GOREGAON EAST MUMBAI",MUMBAI,GREATER BOMBAY,MAHARASHTRA,INDIAN BANK
IDIB000G106,18,GAURI,"GAURI CHAURAHA, RAJEPUR, GAURI BILGRAM TEHSIL, HARDOI DIST, UP, PIN-241303",MALLAWAN,HARDOI,UTTAR PRADESH,INDIAN BANK
IDIB000G107,18,GMS ROAD DEHRADUN,"GMS ROAD, DEHRADUN, DEHRADUN DIST, UTTARAHAND, PIN-248001",DEHRADUN,DEHRA DUN,UTTARAKHAND,INDIAN BANK
IDIB000G108,18,GONDIA,"S N PLAZA, RAIL TOLLY, GONDIA, GONDIA DISTRICT, MAHARASHTRA, PIN 441614",GONDIYA,GONDIA,MAHARASHTRA,INDIAN BANK
IDIB000G109,18,GULMOHAR,"PLOT NO 292, ROHIT NAGAR, PHASE II, GULMOHAR, BHOPAL DIST, MADHYA PRADESH, PIN 462039",BHOPAL,BHOPAL,MADHYA PRADESH,INDIAN BANK
IDIB000G110,18,GOPALGANJ,"JAISHREE COMPLEX, THAWE ROAD, GOPALGANJ, BIHAR, PIN-841428",GOPALGANJ,GOPALGANJ,BIHAR,INDIAN BANK
IDIB000G111,18,GANDHINAGAR  VELLORE,"NO.2 KANGEYANALLUR ROAD, GANDHINAGAR, VELLORE, TAMIL NADU, PIN 632006",KATPADI,VELLORE,TAMIL NADU,INDIAN BANK
IDIB000G112,18,GODAVARIKHANI,HOUSE NO 19-2-42 43 MARKANDEYA COLONY ROAD GODAVARIKHANI,GODAVARIKHANI,KARIMNAGAR,TELANGANA,INDIAN BANK
IDIB000G113,18,GOVINDPURI,"OPPOSITE 30 - TAGORE NAGAR, NEAR SAUGAT APPARTMENT, UNIVERSITY ROAD, GOVINDPURI, GWALIOR, MADHYA PRADESH, PIN-474001",GWALIOR,GWALIOR,MADHYA PRADESH,INDIAN BANK
IDIB000G114,18,GANGAVATHI,"MPL NO.2-17-41-1-B2, WARD NO.10, NEAR CHURCH, OPP.SAIBABA RICE MILL, R G ROAD, GANGAVATHI - 583227, KOPPAL DISTRICT, KARNATAKA",GANGAVATHI,KOPPAL,KARNATAKA,INDIAN BANK
IDIB000G115,18,GIRI NAGAR,"NO. 587, 2ND MAIN ROAD, 2ND PHASE, BANASHANKARI 3RD STAGE, 6TH BLOCK, BANGALORE, KARNATAKA, PIN-560085",BANGALORE,BANGALORE URBAN,KARNATAKA,INDIAN BANK
IDIB000G116,18,GEETA NAGAR,"117 K-136 GEETA NAGAR, NAWABGANJ, KANPUR, UP, PIN-208025",KANPUR,KANPUR CITY,UTTAR PRADESH,INDIAN BANK
IDIB000G117,18,GAMBHEERAM,"NO 2-22-4, BOYAPALEM HIGHWAY, GAMBHEERAM VILLAGE, BOYAPALEM POST, ANANDAPURAM MANDAL, VISAKHAPATNAM, ANDHRA PRADESH, PIN-531163",ANANDAPURAM,VISHAKHAPATNAM,ANDHRA PRADESH,INDIAN BANK
IDIB000G119,18,GIDHAUR,"GIDHAUR PO, JAMUI DIST, BIHAR, PIN-811305",GIDHAUR,JAMUI,BIHAR,INDIAN BANK
IDIB000H001,18,HALAHARVI,KURNOOL- BELLARY ROAD HALAHARVI KURNOOL 518348,HALAHARVI,KURNOOL,ANDHRA PRADESH,INDIAN BANK
IDIB000H007,18,HIDE ROAD,"104/4/4, SATYAN ROY ROADBEHALA KOLKATA700034",KOLKATA,KOLKATA,WEST BENGAL,INDIAN BANK
IDIB000H008,18,HIMAYAT NAGAR,"3-6-150, HIMAYATNAGAR HYDERABAD 500029",HYDERABAD,HYDERABAD URBAN,ANDHRA PRADESH,INDIAN BANK
IDIB000H009,18,HOSHIARPUR,M C H 336ROSHAN ROADHOSHIARPURPUNJAB146001,HOSHIARPUR,HOSIARPUR,PUNJAB,INDIAN BANK
IDIB000H010,18,HOSPET,5/460 STATION ROAD HOSPET 583201,HOSPET,BELLARY,KARNATAKA,INDIAN BANK
IDIB000H011,18,HOSUR,"RVN PLAZA, 120/2 DENKANIKOTTAH ROADOPP GOVT. GENERAL HOSPITALHOSUR635109",HOSUR,KRISHNAGIRI,TAMIL NADU,INDIAN BANK
IDIB000H012,18,HOWRAH,"27/2, G T ROAD, HOWRAH PIN 711101",HOWRAH,HOWRAH,WEST BENGAL,INDIAN BANK
IDIB000H013,18,HYDERABAD MAIN,SURABHI ARCADE BANK STREET HYDERABAD 500 001,HYDERABAD,HYDERABAD URBAN,ANDHRA PRADESH,INDIAN BANK
IDIB000H014,18,HATHRAS,622 AGRA ROAD GHAS MANDI HATHRAS 204101,ALIGARH,ALIGARH,UTTAR PRADESH,INDIAN BANK
IDIB000H015,18,HUBLI,101 SUTARIA COMPLEX KOPPIKAR ROAD HUBLI 580020,HUBLI-DHARWAD,DHARWAD,KARNATAKA,INDIAN BANK
IDIB000H016,18,HALAGALLI,HALAGALLI MUDHOL TALUK BAGALKOTE 587121,HALAGALI,BAGALKOT,KARNATAKA,INDIAN BANK
IDIB000H017,18,HASTINAPURAM,NO.124 RAJENDRA PRASAD RD. NEHRU NAGAR600044,TAMBARAM,KANCHEEPURAM,TAMIL NADU,INDIAN BANK
IDIB000H018,18,HANUMANTHAPURAM,MAIN ROAD HANUMANTHAPURAM PALACODE TALUK DHARMAPURI 636802,HANUMANTHAPURAM,DHARMAPURI,TAMIL NADU,INDIAN BANK
IDIB000H019,18,HAUZ KHAS,106 & 107 AUROBINDO PLACED D A COMMERCIAL COMPLEXDELHI110016,DELHI,NEW DELHI,DELHI,INDIAN BANK
IDIB000H020,18,HATIAKHOWA,HATIKHOWA GOLAGHAT 785626,HATIAKHOWA,GOLAGHAT,ASSAM,INDIAN BANK
IDIB000H021,18,HATHIPUKHARI,HATIPUKHURI SAIDRIA (PO) NAGAON 782125,HATIPUKHURI,NAGAON,ASSAM,INDIAN BANK
IDIB000H023,18,HARRDA,HARRDA MIDNAPUR 721507,HARRDA,WEST MEDINIPUR,WEST BENGAL,INDIAN BANK
IDIB000H025,18,JUBILEE HILLS,4-3-76/1-5 & 6 HILL STREETRANIKUNJ SECUNDERABAD500003,SECUNDERABAD CANTONMENT,HYDERABAD URBAN,ANDHRA PRADESH,INDIAN BANK
IDIB000H027,18,SEC-22 - FARIDABAD,"H NO.540,  SECTOR 22, HOUSING BOARD COLONY, FARIDABAD  PIN 121005",FARIDABAD,FARIDABAD,HARYANA,INDIAN BANK
IDIB000H028,18,HISSAR,SCF 20 RED SQUARE MARKET COMPLEX HISSAR 125001,HISAR,HISSAR,HARYANA,INDIAN BANK
IDIB000H029,18,HALDIA,"AKASH GANGA COMMERCIAL COMPLEX IST FLOOR, BLOCK E, BASUDEBPUR, DURGA CPO KHANJANCHAK, HALDIA, MIDNAPORE DT , WEST B721602",HALDIA,EAST MEDINIPUR,WEST BENGAL,INDIAN BANK
IDIB000H030,18,HIMMAT NAGAR,"GANESH CHAMBER, NEAR BUS STAND, HIMMAT NAGAR 383 001, DIST ┬û SABARKANTHA GUJARAT",HIMATNAGAR,SABARKANTHA,GUJARAT,INDIAN BANK
IDIB000H031,18,HUNTER ROAD,"H.NO.1-7-1043, WARANGAL PUBLIC SCHOOL HUNTER ROAD, WARANGAL ┬û 506 001",WARANGAL,WARANGAL,ANDHRA PRADESH,INDIAN BANK
IDIB000H032,18,HARIDWAR,"ARYANAGAR CHOWK, JWALAPUR, HARIDWAR ┬û 249407",HARDWAR,HARIDWAR,UTTARAKHAND,INDIAN BANK
IDIB000H033,18,HUNSHYAL P.G.,SATHISH SUGARS LTD COMPLEX SANGANKEN YEDWAD ROAD GOKAK TALUK BELGAUM 591124,GOKAK,BELGAUM,KARNATAKA,INDIAN BANK
IDIB000H034,18,HAZIPUR,DAKBUNGALOW ROAD SHARADHA COMPLEX PLOT NO.903CD HAJIPUR VAISHALI DT 844101,HAJIPUR,VAISHALI,BIHAR,INDIAN BANK
IDIB000H035,18,HABRA,"ARENA MARKET, I FLOOR 134, JESSORE ROAD HABRA NORTH 24 PARGANAS 743263",HABRA,NORTH 24 PARGANAS,WEST BENGAL,INDIAN BANK
IDIB000H036,18,HAZARIBAGH,"W. PRASAD COMPLEX, MALVIYA MARG, HAZARIBAGH",HAZARIBAGH,HAZARIBAGH,JHARKHAND,INDIAN BANK
IDIB000H037,18,HARDOI,GHANTAGHAR ROAD HARDOI 241001,HARDOI,HARDOI,UTTAR PRADESH,INDIAN BANK
IDIB000H038,18,HARDEVPURI,"HARDEVPURI,SHADARA,DELHI.PIN110093",DELHI,DELHI,DELHI,INDIAN BANK
IDIB000H039,18,HARINAGAR,"WZ 409 &WZ 409 C, JANAK PARK (NEAR GHANTA GHAR), HARI NAGAR, NEW DELHI - 110064",DELHI,DELHI,DELHI,INDIAN BANK
IDIB000H040,18,HIGH COURT BRANCH MADURAI,"MADURAI BENCH OF MADRAS HIGH COURTULAGANERI, MADURAI  Y.OTHAKADAI",MADURAI,MADURAI,TAMIL NADU,INDIAN BANK
IDIB000H041,18,HALDWANI,AKASH COTTAGE UTTAR GOJAJALI  NEAR NEW MANDI  BAREILLY ROAD HALDWANI 263139,HALDWANI,NAINITAL,UTTARAKHAND,INDIAN BANK
IDIB000H042,18,HOSHANGABAD,VAKRATUNDA SHOPING COMPLEX  OPP M.P.S.R.T.C.BUS STAND  KRISHNAPURI WARD  HOSHANGABAD 461001,HOSHANGABAD,HOSHANGABAD,MADHYA PRADESH,INDIAN BANK
IDIB000H043,18,HATIGAON,"INTEGRITY TOWER  FLOWER LANE, HATIGAON ROAD  HATIGAON 781038",GUWAHATI,KAMRUP,ASSAM,INDIAN BANK
IDIB000H044,18,HANUMANGARH,SHOP NO.243  GENERAL MARKET  STATION ROAD  HANUMANGARH TOWN 335513,HANUMANGARH,HANUMANGARH,RAJASTHAN,INDIAN BANK
IDIB000H046,18,HADAPSAR,3-5 SAHYADRI SARITA  NEAR RAILWAY CROSSING  SASANE NAGAR  HADAPSAR  PUNE MAHARASHTRA-411028,HADAPSAR,PUNE,MAHARASHTRA,INDIAN BANK
IDIB000H047,18,HABSI GUDA,"D NO 7 9 BY 5,BESIDES ISI,STREET NO 8,HABSIGUDA,HYDERABAD,ANDHRA PRADESH,PIN 500007",HABSI GUDA,HYDERABAD,ANDHRA PRADESH,INDIAN BANK
IDIB000H048,18,HMV COLLEGE ROAD JALANDHAR,SCF 8 BSF COLONY OPP HMV COLLEGE IMPROVEMENT SCHEME JALANDHAR DIST PUNJAB PIN 144008,KARTARPUR,JALANDHAR,PUNJAB,INDIAN BANK
IDIB000H049,18,HALDIPADA,"GRAM PANCHAYAT BUILDING, HALDIPADA, BALASORE DIST, ODISSA, PIN-756027",HALDIPADA,BALESHWAR,ODISHA,INDIAN BANK
IDIB000H050,18,HOSUR  KARNATAKA,"KRISHNA NAGAR, HOSUR VILLAGE, BIJAPUR TALUK & DISTRICT, KARNATAKA, PIN-587117",BABALESHWAR,BIJAPUR,KARNATAKA,INDIAN BANK
IDIB000H051,18,HANUMAN NAGAR,"11,MARUDHAR VIHAR HANUMAN NAGAR NEAR VAISHALI NAGAR JAIPUR",JAIPUR,JAIPUR,RAJASTHAN,INDIAN BANK
IDIB000H052,18,HARIANK,PANCHAYAT BUILDING PO HARIANK DIST KENDRAPADA ODISHA,KENDRAPARA,KENDRAPARA,ODISHA,INDIAN BANK
IDIB000H053,18,HIRAN MAGRI,"HIRAN MAGRI, PLOT NO. 227-228, NEAR SHIV MANDIR, D BLOCK, SECTOR-14, UDAIPUR, UDAIPUR DISTRICT, RAJASTHAN, PIN - 313001",UDAIPUR,UDAIPUR,RAJASTHAN,INDIAN BANK
IDIB000H054,18,HANAMKONDA HUNDRED FEET ROAD,"35-6-823, BESIDE TV TOWER COLONY, NEAR SPR SCHOOL, HANAMKONDA, WARANGAL DIST, TELANGANA, PIN-506001",WARANGAL,WARANGAL,TELANGANA,INDIAN BANK
IDIB000H055,18,HINDUPUR,"1-3-2C-S.V.R.COMPLEX, PENUKONDA ROAD, HINDUPUR, ANANTAPUR DIST, ANDHRA PRADESH, PIN-515201",HINDUPUR,ANANTAPUR,ANDHRA PRADESH,INDIAN BANK
IDIB000I001,18,IDAPPADI,55 BAZAAR ST IDAPPADI 637101,IDAPPADI,SALEM,TAMIL NADU,INDIAN BANK
IDIB000I002,18,INDORE,NO.4RNT MARGG-1 GROUND FLOORSHREE VARDHAN COMPLEXINDOREMP  452001,INDORE,INDORE,MADHYA PRADESH,INDIAN BANK
IDIB000I003,18,ITTIVA,"WARD NO.13, DOOR NO.59, CHUNDA JN. ITTIVA, CHERUKULAM P O, ANCHAL, KOLLAM DIT, PIN 691306",ITTIVA,KOLLAM,KERALA,INDIAN BANK
IDIB000I005,18,ICHALKARANJI,P B NO 14410/167 MAIN ROADICHALKARANJI416115,ICHALKARNJI,KOLHAPUR,MAHARASHTRA,INDIAN BANK
IDIB000I010,18,CMDA,"C M D A TOWERS 8, GANDHI IRWIN ROADEGMORE600008",CHENNAI,CHENNAI,TAMIL NADU,INDIAN BANK
IDIB000I012,18,INDIRA NAGAR,"B-1316, SAI PLAZA, B BLOCK CROSSINGINDIRA NAGARLUCKNOW220016",LUCKNOW,LUCKNOW,UTTAR PRADESH,INDIAN BANK
IDIB000I014,18,I M T MANESAR,"SHOW ROOM NO.4-5-7-8, GROUND FLOOR RAHEJA SQUARETOWER 'A'GROUND FLOOWFRONT SIDEIMT MANESAR  GURGAON 122050",GURGAON,GURGAON,HARYANA,INDIAN BANK
IDIB000I015,18,ITANAGAR,"E SECTOR, ITANAGAR 791111  ARUNACHAL  PRADESH",ITANAGAR,PAPUM PARE,ARUNACHAL PRADESH,INDIAN BANK
IDIB000I016,18,INDIRAPURAM,"SHOP NO 32 &33, GAUR GREEN CITY, B BLOCK, PLOT NO. 8, VAIBHAV KHAND, INDIRAPURAM, GHAZIABAD  201010",GHAZIABAD,GHAZIABAD,UTTAR PRADESH,INDIAN BANK
IDIB000I017,18,IRUNGATTUKOTTAI,"PLOT NO: PB-3, NORTH AVENUE ROAD (OPP DOUBLE OHT & NEAR TELEPHONE EXCHANGE) IRUNGATTUKOTTAI SRIPERUMBUDUR TALUK 602 105",IRUNGATTUKOTTAI,KANCHEEPURAM,TAMIL NADU,INDIAN BANK
IDIB000I018,18,IRANIWADI (KANDIVALI WEST),"NO.401/402, FOGLA HOUSE SHOP NO.2 TO 8, GROUND FLOOR HEMUKALYANI CROSS ROAD OFF.MATHURDAS ROAD,IRANIWADI, KANDIVALI (WEST),MUMBAI 400 067",MUMBAI,GREATER MUMBAI,MAHARASHTRA,INDIAN BANK
IDIB000I019,18,IRINJALAKUDA,"USHUS COMPLEX IST FLOOR,TANA, MAIN ROAD,IRINJALAKUDA",IRINJALAKUDA,THRISSUR,KERALA,INDIAN BANK
IDIB000I020,18,ILLUPPUR,"17-17, SUBASREE PLAZA, CHINNA KADAI STREET, ILUPPUR, PUDUKOTTAI DIST, TAMILNADU, PIN-622102",ILLUPPUR,PUDUKKOTTAI,TAMIL NADU,INDIAN BANK
IDIB000I021,18,ITKI,"LAL BADRI NATH SAHDEV, NEAR JAGARNATH TEMPLE, ITKI, RANCHI DIST, JHARKHAND, PIN-835301",ARKI,RANCHI,JHARKHAND,INDIAN BANK
IDIB000J001,18,JAGANNATH PRASAD,MAIN ROAD JAGANNATH PRASAD GANJAM 761121,JAGANNATH PRASAD,GANJAM,ODISHA,INDIAN BANK
IDIB000J002,18,JAGRAON,"RAIKOT ROAD, JHANSI RANI CHOWK, JAGRAON, LUDHIANA DIST 142026",JAGRAON,LUDHIANA,PUNJAB,INDIAN BANK
IDIB000J003,18,JAIPUR,"#10, MOTILAL ATAL MARG,OPP: GANPATHIPLAZA,JAIPUR.302001",JAIPUR,JAIPUR,RAJASTHAN,INDIAN BANK
IDIB000J004,18,JALPAIGURI,DIN BAZAAR 735101,JALPAIGURI,JALPAIGURI,WEST BENGAL,INDIAN BANK
IDIB000J005,18,JAMNAGAR,KASI VISHWANATH ROADJAMNAGAR GUJARAT361001,JAMNAGAR,JAMNAGAR,GUJARAT,INDIAN BANK
IDIB000J006,18,JAMSHEDPUR,"P B NO.63, MAIN ROAD, BISTUPUR, L I C BUILDING, JAMSHEDPUR PURBI SINGHBHUM DIST, JHARKHAND, PIN 831001",JAMSHEDPUR,PURBI SINGHBHUM,JHARKHAND,INDIAN BANK
IDIB000J007,18,JABALPUR,426MARHATAAL WARD  KALAM CHAND CHOWKJABALPURMADHYA PRADESH 482002,JABALPUR,JABALPUR,MADHYA PRADESH,INDIAN BANK
IDIB000J008,18,JARIKONDALAMPATTI,"284, CALICUT MAIN ROADJARIKONDALAMPATTISALEM636010",SALEM,SALEM,TAMIL NADU,INDIAN BANK
