ifsc,bank_id,branch,address,city,district,state,bank_name
IDIB000M285,18,MAHAMAHAM,6 BY 26 VADIVAIKAL STREET KUMBAKONAM THANJAVUR TAMIL NADU,KUMBAKONAM,THANJAVUR,TAMIL NADU,INDIAN BANK
IDIB000M287,18,METTUPATTI,"6/57A, PATHANGALMEDU, METTUPPATTI PO, VAAZHAPADI TALUK, SALEM DIST, TAMIL NADU, PIN - 636111",KARIPATTI,SALEM,TAMIL NADU,INDIAN BANK
IDIB000M288,18,MEHUWALA,"SHIMLA BYPASS ROAD, MEHUWALA, DEHRADUN DIST, UTTARAHAND, PIN-248171",MOHEBEWALA,DEHRA DUN,UTTARAKHAND,INDIAN BANK
IDIB000M289,18,MUTTOM HARBOUR,PORT BLOCK BUILDING JEPPIAAR FISHING HARBOUR MUTTOM KANYAKUMARI DIST TAMIL NADU PIN 629202,KALKULAM,KANYAKUMARI,TAMIL NADU,INDIAN BANK
IDIB000M290,18,MORAMPUDI ROAD,"85-6-15, ROUTHU PLAZA, MORAMPUDI ROAD, V L PURAM, RAJAHMUNDRY, ANDHRA PRADESH, PIN-533101",RAJAHMUNDRY,EAST GODAVARI,ANDHRA PRADESH,INDIAN BANK
IDIB000M291,18,MADDILAPALEM,"SRI KRISHNA TOWERS, S.NO.5, BLOCK NO 1 ,WALTAIR WARD, VIP ROAD, DIVISION NO 16, VISAKHAPATNAM, ANDHRA PRADESH, PIN-533013",VISAKHAPATNAM,VISHAKHAPATNAM,ANDHRA PRADESH,INDIAN BANK
IDIB000M292,18,MANDIR HASSAUD,"GOYAL COMPLEX, NH6, BUS STAND CHOWK, MANDIR HASSAUD, RAIPUR DIST, CHATTISGARH, PIN 492101",MANDIR HASOD,RAIPUR,CHHATTISGARH,INDIAN BANK
IDIB000M293,18,MUNGER,"I FLOOR, ROYAL PALACE, NEELAM CINEMA ROAD, ABDUL HAMID CHOWK, MUNGER, MUMGER DIST, BIHAR, PIN-811201",MUNGHYR,MUNGER,BIHAR,INDIAN BANK
IDIB000M294,18,MARIANI,"MARIANI MAIN ROAD, MARIANI, TITABOR TALUK, JORHAT DIST, ASSAM, PIN-785634",MARIANI,JORHAT,ASSAM,INDIAN BANK
IDIB000M295,18,MATHUR SIPCOT,"408, MANGAL KUTTU ROAD, MATHUR, CHEYYAR TALUK, TIRUVANNAMALAI DIST, TAMIL NADU, PIN-631701",MAMANDUR,TIRUVANNAMALAI,TAMIL NADU,INDIAN BANK
IDIB000M296,18,MATHIGIRI,"AMMAN NAGAR MATHIGIRI KOOTU ROAD MATHIGIRI DHARMAPURI DIST TAMIL NADU, PIN 635109",MATHIGIRI,KRISHNAGIRI,TAMIL NADU,INDIAN BANK
IDIB000M297,18,MADURAVOYAL,"PLOT NO.4A/1,4A2, MMDA, I MAIN ROAD, MADURAVOYAL, CHENNAI,TAMIL NADU, PIN-600095",MADURAVAYAL,THIRUVALLUR,TAMIL NADU,INDIAN BANK
IDIB000M298,18,MATWANI,"MATWANI VILLAGE & PO, MOGA TEHSIL, MOGA DISTRICT, PUNJAB, PIN-142053",MOGA,MOGA,PUNJAB,INDIAN BANK
IDIB000M299,18,MARADU,MARADU NETTOOR PO ERNAKULAM KERALA,MARADU,ERNAKULAM,KERALA,INDIAN BANK
IDIB000M300,18,MACHHRAULI,VILLAGE AND POST MACHHRAULI TEHSIL SAMALKHA DIST PANIPAT HARYANA,MACHHRAULI,YAMUNANAGAR,HARYANA,INDIAN BANK
IDIB000M301,18,MAHANADI VIHAR,"PLOT NO-1282, SHAS, MAHANADI VIHAR, CUTTACK DIST, ORISSA, PIN - 753004",CUTTACK,CUTTACK,ODISHA,INDIAN BANK
IDIB000M302,18,MAHASAMUND,"DOOR NO 116, PURANA RAIPUR NAKA, RAIPUR ROAD,WARD NO 12, MAHASAMUND, CHHATTISGARH, PIN-493445",MAHASAMUND,MAHASAMUND,CHHATTISGARH,INDIAN BANK
IDIB000M303,18,MAHARAJA NAGAR,"PLOT NO 11 ,NEAR RAILWAY CROSSING, OPP TAMILNADU HOUSING BOARD OFFICE, MAHARAJA NAGAR, TIRUNELVELI, TAMILNADU, PIN-627007",TIRUNELVELI,TIRUNELVALI,TAMIL NADU,INDIAN BANK
IDIB000M304,18,MANAKPUR,"NEAR DHIMAN STEEL WORK, MANAKPUR VILLAGE & PO, PATIALA DIST, PUNJAB, PIN-140602",MANAK PURA,PATIALA,PUNJAB,INDIAN BANK
IDIB000M305,18,MIRYALAGUDA,"H NO 19-433, REDDY COLONY, MIRYALAGUDA, NALGONDA DISTRICT, TELANGANA, PIN-508207",MIRYALGUDA,NALGONDA,TELANGANA,INDIAN BANK
IDIB000M306,18,MAHENDERGARH,"GAUSHALA ROAD, OPP. RAJA MARRIAGE PALACE, MAHENDERGARH, HARYANA, PIN-123029",MAHENDRAGARH,MAHENDRAGARH,HARYANA,INDIAN BANK
IDIB000M307,18,MAULA ALI,"H.NO.3-5-255, MAIN ROAD, KRISHNA NAGAR COLONY, MAULA ALI, HYDERABAD, TELANGANA, PIN-500040",HYDERABAD,HYDERABAD,TELANGANA,INDIAN BANK
IDIB000M308,18,MVP COLONY,"NO 1-33-13,PLOT NO.2, SECTOR NO.3, MVP DOUBLE ROAD, VISAKHAPATNAM, ANDHRA PRADESH, PIN-530017",VISAKHAPATNAM,VISHAKHAPATNAM,ANDHRA PRADESH,INDIAN BANK
IDIB000M309,18,MANNIVAKKAM,"1ST FLOOR, MSL COMPLEX, LAGANATHAN NAGAR, VANDALUR - WALLAJABAD ROAD, MANNIVAKKAM, CHENNAI, TAMILNADU, PIN-600048",TAMBARAM,KANCHEEPURAM,TAMIL NADU,INDIAN BANK
IDIB000M310,18,MANAVALA NAGAR,"DOOR NO. 26/4, P.H.ROAD, MANAVALA NAGAR, THIRUVALLUR DIST, TAMILNADU, PIN-602002",MANAVALANAGAR,THIRUVALLUR,TAMIL NADU,INDIAN BANK
IDIB000M311,18,MELMONAVUR,"NO.22, NEW STREET, BANGALORE MAIN ROAD, AVARAMPALAYAM, MELMONAVUR, VELLORE DIST, TAMILNADU, PIN-632010",KONAVATTAM,VELLORE,TAMIL NADU,INDIAN BANK
IDIB000N001,18,NACHIAPURAM,6/71 NACHIAR AMMAN KOIL STREET NACHIAPURAM SIVAGANGA 630207,SIVAGANGA,SIVAGANGA,TAMIL NADU,INDIAN BANK
IDIB000N002,18,NADIAD,"SANTRAM ROAD, OPP. FOUNTAIN, NADIAD, KHERA DISTRICT PIN 387001",NADIAD,KHEDA,GUJARAT,INDIAN BANK
IDIB000N003,18,NADUVATTAM,16/139 OOTY MYSORE ROAD NADUVATTAM NILGIRIS 643224,NADUVATTAM,NILGIRIS,TAMIL NADU,INDIAN BANK
IDIB000N004,18,NAGAPATTINAM,P B NO 8 NETHAJI ROADNAGAPATTINAM611001,NAGAPATTINAM,NAGAPATTINAM,TAMIL NADU,INDIAN BANK
IDIB000N005,18,NAGARAM,PUDIVADA ROAD NAGARAM GUNTUR 522268,NAGARAM,GUNTUR,ANDHRA PRADESH,INDIAN BANK
IDIB000N006,18,NAGERCOIL,"165, WOMEN'S CHRISTIAN -COLLEGE ROADNAGERCOIL 629001",NAGERCOIL,KANNIYAKUMARI,TAMIL NADU,INDIAN BANK
IDIB000N007,18,NAGPUR,GOTMARE MARKET LAKSHMI BHAVAN SQUARE DHARAMPETH  NAGPUR 440010  PHONES :,NAGPUR,NAGPUR,MAHARASHTRA,INDIAN BANK
IDIB000N008,18,NAKODAR,1941RAILWAY ROAD NAKODAR  JALANDHAR DIST.  PUNJAB  141310,NAKODAR,JALANDHAR,PUNJAB,INDIAN BANK
IDIB000N009,18,NALGONDA,HARIDEEP COMPLEXPRAKASAM BAZAAR 508001,NALGONDA,NALGONDA,ANDHRA PRADESH,INDIAN BANK
IDIB000N010,18,NALANCHIRA,M C ROAD NALANCHIRATHIRUVANANTHAPURAM 695015,NALANCHIRA,TRIVANDRUM,KERALA,INDIAN BANK
IDIB000N011,18,NAMAKKAL,"31, RANGAR SANNADHI STREET, NAMAKKAL, NAMAKKAL DIST. TAMIL NADU PIN 637001",NAMAKKAL,NAMAKKAL,TAMIL NADU,INDIAN BANK
IDIB000N012,18,NANAPETH,"612-B, PARSI AGIARY, NANAPETH, PUNE  411002",PUNE,PUNE,MAHARASHTRA,INDIAN BANK
IDIB000N013,18,NARANPURA,"5 NARASINH PARK SOCIETY, VIJAY NAGAR CHAR RASTA, NARANPURA, AHMEDABAD 380013",AHMEDABAD,AHMEDABAD,GUJARAT,INDIAN BANK
IDIB000N014,18,NARASARAOPET,6/1/211/212 MAIN ROAD NARASARAOPETGUNTUR522601,NARSARAOPET,GUNTUR,ANDHRA PRADESH,INDIAN BANK
IDIB000N015,18,NARAYANAGUDA,"3-6-9431ST FLOOR, PANCHAVATI MALLNARAYANAGUDA500029",HYDERABAD,HYDERABAD URBAN,ANDHRA PRADESH,INDIAN BANK
IDIB000N016,18,NASIK CITY,"PB 122, 480 Y, SWAMI R P ROAD NASIKMAHARASHTRA422002",NASHIK,NASHIK,MAHARASHTRA,INDIAN BANK
IDIB000N017,18,NAVRANGPURA,OPP. TELEPHONE EXCHANGE C G ROAD NAVRANGPURA  AHMEDABAD3800006,AHMEDABAD,AHMEDABAD,GUJARAT,INDIAN BANK
IDIB000N018,18,NELLIKUPPAM,37 NEW STREET NELLIKUPPAM 607105,NELLIKUPPAM,CUDDALORE,TAMIL NADU,INDIAN BANK
IDIB000N019,18,NELLORE,SAI VISWANATHA SHOPPING COMPLEXTRUNK ROADNELLORE524001,NELLORE,NELLORE,ANDHRA PRADESH,INDIAN BANK
IDIB000N020,18,NEMILI,"184, A, ANNA SALAI NEMILI VELLORE 631051",NEMILI,VELLORE,TAMIL NADU,INDIAN BANK
IDIB000N021,18,NERKUPPAI,"14-A, RAJA VEETHI, NERKUPPAI, SIVAGANGA DIST. PIN 630405",NERKUPPAI,SIVAGANGA,TAMIL NADU,INDIAN BANK
IDIB000N022,18,NEW DELHI MAIN,P 45/90 CONNAUGHT PLACE NEW DELHI 110  001,DELHI,NEW DELHI,DELHI,INDIAN BANK
IDIB000N023,18,NEW TIMBER YARD LAYOUT,"39/1, N G HALLIMYSORE ROADNEW TIMBER YARD LAYOUT560026",BANGALORE,BANGALORE URBAN,KARNATAKA,INDIAN BANK
IDIB000N024,18,NEYVELI  MAIN,"12/3, MAIN BAZAAR BLOCK - 12 NEYVELI 607803",NEYVELI,CUDDALORE,TAMIL NADU,INDIAN BANK
IDIB000N026,18,NIALI,NO 2516 MAIN ROAD NIALI 754004,NIALI,CUTTAK,ODISHA,INDIAN BANK
IDIB000N027,18,NIDADAVOLE,11-4-156MAIN ROAD NIDADAVOLEWEST GODAVARI DISTRICTA P534301,NIDADAVOLE,WEST GODAVARI,ANDHRA PRADESH,INDIAN BANK
IDIB000N028,18,NIDAMANGALAM,12 A MELARAJAVEEDHI NIDAMANGALAM THIRUVARUR 614404,NIDAMANGALAM,TIRUVARUR,TAMIL NADU,INDIAN BANK
IDIB000N029,18,NIMMANAPALLE,RAJA STREET NIMMANAPALLE CHITTOOR 517280,NIMMANAPALLE,CHITTOR,ANDHRA PRADESH,INDIAN BANK
IDIB000N030,18,NIRANAM,2-A/3 MAIN ROAD NIRANAM 689621,KADAPRA,PATHANAMTHITTA,KERALA,INDIAN BANK
IDIB000N031,18,NIZAMABAD,7-1-62 GODOWN ROAD NIZAMABAD 503001,NIZAMABAD,NIZAMABAD,ANDHRA PRADESH,INDIAN BANK
IDIB000N032,18,NORTH USMAN ROAD,NO.169/72NORTH USMAN ROADT NAGAR600017,CHENNAI,CHENNAI,TAMIL NADU,INDIAN BANK
IDIB000N033,18,NUNGAMBAKKAM,NO.125 VALLUVAR KOTTAM HIGH RD NUNGAMBAKKAM600034,CHENNAI,CHENNAI,TAMIL NADU,INDIAN BANK
IDIB000N034,18,NEPEAN SEA ROAD,NAV SHANTI NAGAR98 NEPEAN SEA ROAD  GREATER MUMBAI 400006,MUMBAI,GREATER MUMBAI,MAHARASHTRA,INDIAN BANK
IDIB000N035,18,NALLAMPALLI,SALEM MAIN ROAD NALLAMPALLI DHARMAPURI 636807,NALLAMPALLI,DHARMAPURI,TAMIL NADU,INDIAN BANK
IDIB000N036,18,NANJANGUD,R M CIRCLE RSHTRAPATHI ROAD NANJANGUD 571301,NANJANGUD,MYSORE,KARNATAKA,INDIAN BANK
IDIB000N037,18,NANDYAL,428/2 SRINIVASA NAGAR NANDYAL ANDHRA PRADESH 518501,NANDYAL,KURNOOL,ANDHRA PRADESH,INDIAN BANK
IDIB000N038,18,NAGAON,S S ROAD NAGAON 782002,NAGAON,NAGAON,ASSAM,INDIAN BANK
IDIB000N039,18,NABHA,CINEMA ROAD NABHA 147210,NABHA,PATIALA,PUNJAB,INDIAN BANK
IDIB000N040,18,NIPANI,"24, ASHOK NAGAR NIPANI BELGAUM 591237",NIPANI,BELGAUM,KARNATAKA,INDIAN BANK
IDIB000N041,18,NAWANSHAHR DOABA,RAILWAY ROAD  NAWAN SHAHAR DOABAJALANDHAR DIST. PUNJAB144514,JALANDHAR,JALANDHAR,PUNJAB,INDIAN BANK
IDIB000N042,18,NAVSARI,"NO. 231, M G ROAD, NAVSARI, VALSAD  396445",NAVSARI,NAVSARI,GUJARAT,INDIAN BANK
IDIB000N043,18,NILAMBUR,D NO 11/965 ARMEX CENTRE CNG ROAD NILAMBUR MALAPPURAM 679329,NILAMBUR,MALAPURAM,KERALA,INDIAN BANK
IDIB000N044,18,NEHRU PLACE (DELHI),"47,48 PRAGATHI HOUSE, NEHRU PLACE, DELHI-110 019.",DELHI,NEW DELHI,DELHI,INDIAN BANK
IDIB000N045,18,NERAVY,1 EAST KING STREET NERAVY KARAIKKAL 609604,NERAVY,KARAIKAL,PUDUCHERRY,INDIAN BANK
IDIB000N046,18,NURPUR,VPO NURPUR THE NAKODAR JALANDHAR 141310,NOORPUR,JALANDHAR,PUNJAB,INDIAN BANK
IDIB000N047,18,NIZAMPUR,56 DELHI ROAD NIZAMPUR PHILKUWA GHAZIABAD 201001,NIZAMPUR,GHAZIABAD,UTTAR PRADESH,INDIAN BANK
IDIB000N048,18,LAKHIMPUR,I FLOOR ABBAS MARKET MALPANI CHARIALI WARD NO 11 K B ROAD 787001,NORTH LAKHIMPUR,LAKHIMPUR,ASSAM,INDIAN BANK
IDIB000N049,18,NALLUR,"1/71 A VELUR MAIN ROAD NALLUR, KANDAMPALAYAM POST PARAMATHI TALUK NAMAKKAL 637203",NALLUR,NAMAKKAL,TAMIL NADU,INDIAN BANK
IDIB000N050,18,NAGARI,"NAGARINO.9-28,SRINIVASA MULTI COMNAGALAPURAM ROAD517590",NAGARI,CHITTOR,ANDHRA PRADESH,INDIAN BANK
IDIB000N051,18,NEDUNURU,1/64 MAIN ROAD NEDUNURU 533243,NEDUNURU,EAST GODAVARI,ANDHRA PRADESH,INDIAN BANK
IDIB000N052,18,NARIMAN POINT MUMBAI,MITTAL TOWER 210 NARIMAN POINT MUMBAI 400 021,MUMBAI,GREATER MUMBAI,MAHARASHTRA,INDIAN BANK
IDIB000N053,18,NASIK AMBAD INDUSTRIAL ESTATE,C F C BUILDINGM I D C AMBAD INDUSTRIAL ESTATE NASIK MAHARASHTRA422010,NASHIK,NASHIK,MAHARASHTRA,INDIAN BANK
IDIB000N054,18,NEW NALLAKUNTA,"2-2-1130-24/1/ A /1 SHIVAM ROADPRASANTH NAGAR, NEW NALLAKUNTA500044",HYDERABAD,HYDERABAD URBAN,ANDHRA PRADESH,INDIAN BANK
IDIB000N056,18,NALLAMBAKKAM,15 VANDALUR-KELAMBAKKAM MAIN ROAD KANDIGAI VIL MELAKOTTAIYUR 600048,NALLAMBAKKAM,KANCHEEPURAM,TAMIL NADU,INDIAN BANK
IDIB000N057,18,NEYVELI BLOCK 17,TOWN CLUB ROAD BLOCK - 17NEYVELI607801,NEYVELI,CUDDALORE,TAMIL NADU,INDIAN BANK
IDIB000N058,18,N POOLAMPATTI,"1C, CONVENT ROAD, I FLOOR N POOLAMPATTI TRICHY 621302",N.POOLAMPATTI,TIRUCHIORAPPALLI,TAMIL NADU,INDIAN BANK
IDIB000N060,18,NADANTHAI,MAIN ROAD NADANTHAI NAMAKKAL 637206,NADANTHAI,NAMAKKAL,TAMIL NADU,INDIAN BANK
IDIB000N061,18,UTHAMAR GANDHI SALAI (CHENNAI),"9 VALLUVAR KOTTAM HIGH ROAD, UTHAMAR GANDHI SALAI, CHENNAI-600 034. PHONE NO.",CHENNAI,CHENNAI,TAMIL NADU,INDIAN BANK
IDIB000N062,18,NEHRU NAGAR,MAIN ROADNEHRU NAGARGUNTUR522001,GUNTUR,GUNTUR,ANDHRA PRADESH,INDIAN BANK
IDIB000N063,18,NARASHIMARAOPET,"25-11-2, BANK ST.NARASIMHARAOPETA, ELURU WEST GODAVARI  534006",ELURU,WEST GODAVARI,ANDHRA PRADESH,INDIAN BANK
IDIB000N064,18,NAAL ROAD,CHAMUNDI SHOPPING COMPLEXOMALUR ROADSALEM636007,SALEM,SALEM,TAMIL NADU,INDIAN BANK
IDIB000N065,18,NEDUNGUNAM,SOUTH MADA STREET NEDUNGUNAM TIRUVANMALAI 606807,NEDUNGUNAM,TIRUVANNAMALAI,TAMIL NADU,INDIAN BANK
IDIB000N066,18,NEW THIPPASANDRA,622EIGHTY FEET ROADNEW THIPPASANDRA12TH MAIN ROADH A L SECOND STAGEBANGALORE560008,BANGALORE,BANGALORE URBAN,KARNATAKA,INDIAN BANK
IDIB000N067,18,NARWARA,NARWARA VIA MINAPUR SHEOHAR 843128,NARWARA,SEOHAR,BIHAR,INDIAN BANK
IDIB000N068,18,NANDIGAMA,1ST FLOOR SRI VIGNESWARA COMPLEX MAIN ROAD NANDIGAMA 521185,NANDIGAMA,KRISHNA,ANDHRA PRADESH,INDIAN BANK
IDIB000N069,18,NEWARI,NEWAR PO NEWARI VIA SAKURABAD JEHANABAD,NEWARI,JEHANABAD,BIHAR,INDIAN BANK
IDIB000N070,18,NUZVID,25/155 KOTHAPET NUZVID 521201,NUZVID,KRISHNA,ANDHRA PRADESH,INDIAN BANK
IDIB000N072,18,NEERPALANI,2/169B MAIN ROAD NEERPALANI VIA MATHUR INDL ESTATE PUDUKOTTAI 622515,NEERPALANI,PUDUKKOTTAI,TAMIL NADU,INDIAN BANK
IDIB000N074,18,NOLAMBUR,48 D PILLAIYAR KOIL STREET NOLAMBUR VILLUPURAM 604307,NOLAMBUR,VILLUPURAM,TAMIL NADU,INDIAN BANK
IDIB000N076,18,MEENAKSHIPURAM,"136, 1ST FLOOR,ASTAAG SHOPPING COMPLEX CAPE ROAD, NAGERCOIL629001",NAGERCOIL,KANNIYAKUMARI,TAMIL NADU,INDIAN BANK
IDIB000N077,18,NAGORE,385 MAIN ROAD NAGORE 611002,NAGORE,NAGAPATTINAM,TAMIL NADU,INDIAN BANK
IDIB000N078,18,NANDANAM,NO. 480ANNA SALAINANDANAM  600035,CHENNAI,CHENNAI,TAMIL NADU,INDIAN BANK
IDIB000N079,18,NANGANALLUR,PLOT 7B/8VI MAIN RD.NANGANALLUR600061,CHENNAI,CHENNAI,TAMIL NADU,INDIAN BANK
IDIB000N080,18,NATARAMPALLI,69/4 R C S MAIN STREET NATRAMPALLI 635852,NATRAMPALLI,VELLORE,TAMIL NADU,INDIAN BANK
IDIB000N082,18,NAWABPET,4/201-202 NAWABPET 524002,NELLORE,NELLORE,ANDHRA PRADESH,INDIAN BANK
IDIB000N084,18,KORAMANGALA,"NO.512,4TH CROSS,6TH BLOCKKORAMANGALA560095",BANGALORE,BANGALORE URBAN,KARNATAKA,INDIAN BANK
IDIB000N085,18,CUDDAPAH,AMEEN COMPLEX NEAR OLD BUS STAND CUDDAPAH 516001,CUDDAPAH,CUDDAPAH,ANDHRA PRADESH,INDIAN BANK
IDIB000N086,18,NAIDUMANGALAM,PILLAIYAR KOIL STREET NAIDUMANGALAM TIRUVANNAMALAI 606802,NAIDUMANGALAM,TIRUVANNAMALAI,TAMIL NADU,INDIAN BANK
IDIB000N089,18,NEELANKARAI,321KARUNANIDHI SALAI SRI KAPALEESWAR NAGAR  NEELANKARAICHENNAI 600041,CHENNAI,CHENNAI,TAMIL NADU,INDIAN BANK
IDIB000N099,18,SECTOR - 9D CHANDIGARH,SCO 48-49SECTOR  9 - D  MADHYA MARG160017,CHANDIGARH,CHANDIGARH,CHANDIGARH,INDIAN BANK
IDIB000N100,18,BANGA,"NEAR SANT BABA, SEWA SINGH CHOWK, CHANDIGARH ROAD, BHANGA, JALANDHAR DISTRICT, PIN 144505",POONIAN(BANGA),JALANDHAR,PUNJAB,INDIAN BANK
IDIB000N101,18,GARHSHANKAR,"OPP. BUS STAND, GARHSHANKAR, HOSHIARPUR, PIN 144527",GARHSHANKAR,HOSIARPUR,PUNJAB,INDIAN BANK
IDIB000N103,18,MAHILPUR,PHAGWARA ROAD MAHILPUR,MAHALPUR,HOSHIARPUR,PUNJAB,INDIAN BANK
IDIB000N104,18,NRI RANNI,MADAPALLI BLDGS COLLEGE ROAD RANNI PATHANAMTHITTA 689673,RANNI,PATHANAMTHITTA,KERALA,INDIAN BANK
IDIB000N105,18,NAKKAMPADI,MAIN ROAD K S SARBUDHIN BLDG PALAIYUR(VIA)  NAKKAMBADI NAGAPATTINAM 612203,NAKKAMPADI,NAGAPATTINAM,TAMIL NADU,INDIAN BANK
IDIB000N106,18,KANHANGAD,NORTH KOTTACHERRY KANHANGAD KASARAGOD 671315,KANHANGAD,KASARAGOD,KERALA,INDIAN BANK
IDIB000N107,18,NALLASOPARA,"CHAWARE BLDGSIMLA SHOPPING CENTRE NALLSOPARA (W),VASAI TK, 401203",NALLASOPARA,THANE,MAHARASHTRA,INDIAN BANK
IDIB000N108,18,NOIDA,"D-41, SECTOR 59GAUTAM BUDH NAGAR  DIST.UTTAR PRADESH  201307",NOIDA,GAUTAM BODDA NAGAR,UTTAR PRADESH,INDIAN BANK
IDIB000N109,18,NANDGRAM,"ST. JOSEPH┬ÆS HOSPITAL, MARIAM NAGAR, MEERUT ROAD POST,GHAZIABAD ┬û 201 003",GHAZIABAD,GHAZIABAD,UTTAR PRADESH,INDIAN BANK
IDIB000N110,18,NERUL,"LOWER GF VEDA PATSHALA BUILDING SIES CAMPUS, ADI SHANKARACHARYA MARG PLOT NO 1 D, SECTOR 5,NERUL (EAST)NAVI MUMBAI 400706",MUMBAI,GREATER MUMBAI,MAHARASHTRA,INDIAN BANK
IDIB000N112,18,NEW HORIZON COLLEGE OF ENGINEERING  BANGALORE,OUTER RING ROAD KADUBISANAHALLI PANATHUR PO BANGALORE 560087,BANGALORE,BANGALORE URBAN,KARNATAKA,INDIAN BANK
IDIB000N113,18,NAGAMALAI PUDUKKOTTAI,"7/772, FIRST FLOOR, CHINNA HALL KALAIGNAR KARUNANIDHI ST NAGAMALAI PUDUKKOTTAI MADURAI 625 019",MADURAI,MADURAI,TAMIL NADU,INDIAN BANK
IDIB000N114,18,NGO COLONY TIRUNELVELI,"997/2 A3, SUNDARI COMPLEX TIRUVANANTHAPURAM ROAD NEAR NEW BUS STAND TIRUNELVELI 627007",TIRUNELVELI,TIRUNELVELI,TAMIL NADU,INDIAN BANK
IDIB000N115,18,NOCHILI,PALLIPET MAIN ROAD NOCHILI-631202,TIRUVALLUR,TIRUVALLUR,TAMIL NADU,INDIAN BANK
IDIB000N116,18,NALLAGANDLA,"1,2 & 3, SAI KRISHNA ARCADE NALLAGANDLA SERILINGAMPALLY 500019",SERI-LINGAMPALLY,RANGA REDDY,ANDHRA PRADESH,INDIAN BANK
IDIB000N117,18,NATHAM,829/1DINDIGUL ROAD NEAR GOVT HOSPITAL NATHAM 624401,NATHAM,DINDIGUL,TAMIL NADU,INDIAN BANK
IDIB000N118,18,NAGUDI,102/9A TO C ARANTANGI MAIN ROAD NAGUDI 614616,ARANTANGI,PUDUKKOTTAI,TAMIL NADU,INDIAN BANK
IDIB000N119,18,NEEMUCH,"HOUSE NO.1 FIROZ SHAH MARG, VIJAY TALKIES CHOURAYA, NEEMUCH, MADHYA PRADESH 458441",NEEMUCH,NEEMUCH,MADHYA PRADESH,INDIAN BANK
IDIB000N120,18,NEW PANVEL,"FLAT NO. 1 & 2, DAFFODILS , BUILDING,PANVEL-MATHERAN ROAD, SECTOR -12, PLOT NO.24, NEW PANVEL , NAVI MUMBAI, RAIGAD, MAHARASHTRA  410206",PANVEL,RAIGAD,MAHARASHTRA,INDIAN BANK
IDIB000N121,18,NAZIRA,"NAZIRA MAIN ROAD, NAZIRA, SIBSAGAR, ASSAM - 785685",NAZIRA TOWN,SIBSAGAR,ASSAM,INDIAN BANK
IDIB000N122,18,NESAPAKKAM,"NO.12, VEMBULIAMMAN KOIL STREET, WEST K.K. NAGAR,CHENNAI.- 600078",CHENNAI,CHENNAI,TAMIL NADU,INDIAN BANK
IDIB000N123,18,NAVY NAGAR  COLABA,"RETAIL ISSUE SHOP , NAVY NAGAR, COLABA, MUMBAI, MAHARASHTRA - 400005",MUMBAI,GREATER MUMBAI,MAHARASHTRA,INDIAN BANK
IDIB000N124,18,NEW ERA SCHOOL  ULHASNAGAR,"NEAR NEW ERA SCHOOL, FURNITURE BAZZAR, ULHASNAGAR, THANE, MAHARASHTRA - 421003",ABITGHAR,THANE,MAHARASHTRA,INDIAN BANK
IDIB000N125,18,NAYAGARH,"KHANDAPADA ROAD, NAYAGARH, NAYAGARH(DIST), ORISSA(STATE), PIN 752069",NAYAGARH,NAYAGARH,ODISHA,INDIAN BANK
IDIB000N126,18,NARASIPATNAM,"VARAHA PLAZA,9TH WARD,BANGARRAJU COMPLEX,NARSIPATNAM",NARSIPATNAM,VISHAKHAPATNAM,ANDHRA PRADESH,INDIAN BANK
IDIB000N127,18,NAIDUPET,"ORR COMPLEX,NEAR R AND B GUEST HOUSE,OLD GNT ROAD,NAIDUPET",NAIDUPET,NELLORE,ANDHRA PRADESH,INDIAN BANK
IDIB000N128,18,NORTH PARAVUR,"MGM HALL, IST FLOOR,ST. THOMAS JACOBITE SYRIAN CHURCH,NORTH PARAVUR",PARAVUR,ERNAKULAM,KERALA,INDIAN BANK
IDIB000N129,18,NAINITAL,"99,BARA BAZAAR  OPP-SHIVA RESTAURANT  MALITAL  NAINITAL 263001",NAINITAL,NAINITAL,UTTARAKHAND,INDIAN BANK
IDIB000N130,18,NEWAI,"NEAR F C I GODOWN,JAIPUR ROAD,NEWAI",NEWAI,TONK,RAJASTHAN,INDIAN BANK
IDIB000N131,18,NAHARLAGOON,KIPA COMMERCIAL CENTRE  G EXTENSION ROAD  NAHARLAGUN 791110,NAHARLAGUN,PAPUMPARE,ARUNACHAL PRADESH,INDIAN BANK
IDIB000N132,18,NEYYOOR,CSI HOSPITAL CAMPUS  NEYYOOR 629802,NAGERCOIL,KANYAKUMARI,TAMIL NADU,INDIAN BANK
IDIB000N133,18,NILAGIRI,204  AVP ALAGAMMAL NAGAR  TRICHY MAIN ROAD  THANJAVUR TAMIL NADU-613005,THANJAVUR,THANJAVUR,TAMIL NADU,INDIAN BANK
IDIB000N134,18,NAGAVALLI,NO 1 & 2  B R HILLS MAIN ROAD  NAGAVALLI POST AND VILLAGE  NAGAVALLI 571342,CHANDAKAVADY,CHAMARAJANAGAR,KARNATAKA,INDIAN BANK
IDIB000N135,18,NACHIKURICHI,"1/512,1 ST STREETINDIRAGANDHI NAGARNACHIKURICHITRICHYTAMIL NADU-620102",TIRUCHIRAPPALLI,TIRUCHIRAPALLI,TAMIL NADU,INDIAN BANK
IDIB000N136,18,NAVEEN SHAHDARA,813/1G T ROQADNAVEEN SHQHDARASHAHDARA DELHI-110032,DELHI,DELHI,DELHI,INDIAN BANK
IDIB000N137,18,NAZAFAGARH,SAINIK ENCLAVENANGLI SAKRAWATINAJAFGARH  DELHI-110043,NANGLI SAKRAWATI,DELHI,DELHI,INDIAN BANK
IDIB000N138,18,NALAGAMPALLE,PES IMSR  KUPPAM-CHITTOOR ROAD  NALAGAMPALLE CHITTOOR ANDHRA PRADESH-517425,KUPPAM,CHITTOOR,ANDHRA PRADESH,INDIAN BANK
IDIB000N139,18,NANGLOI,SHRI KANHA RAM COMPLEX AMANPURI MAIN .NAJAFGARH ROAD NANGLOI,SULTANPURI,DELHI,DELHI,INDIAN BANK
IDIB000N140,18,NATHAMPANNAI,"BHARATHI VIDYALALA AB.ED COLLEGE,TRICHY ROAD,THIRUKORANAM,PUDUKOTTAI",PUDUKOTTAI,PUDUKOTTAI,TAMIL NADU,INDIAN BANK
IDIB000N141,18,NADEPAR,"NADEPAR, BLOCK JOGIA, TAHSIL NAUGARH, SIDHARTHANAGAR DIST, UTTAR PRADESH, PIN - 272207",JOGIA,SIDHARTHANAGAR,UTTAR PRADESH,INDIAN BANK
IDIB000N142,18,NIMMIYAMBATTU,"MAIN ROAD,NIMMIYAMBATTU,VANIYAMBADI TALUK,VELLORE DIST,TAMIL NADU,PIN 635752",NIMMIYAMBATTU,VELLORE,TAMIL NADU,INDIAN BANK
IDIB000N143,18,NEDUMANGAD,"RESURVEY NO 788 BY 10 1,KULAVIKONAM JUNCTION,NEDUMANGAD,KERALA,PIN 695541",NEDUMANGAD,THIRUVANANTHAPURAM,KERALA,INDIAN BANK
IDIB000N144,18,NANDHIVARAM,"NO.3,KUBERAR NAGAR FIRST ST,NANDHIVARAM,GUDUVANCHERI,KANCHEEPURAM DIST,TAMIL NADU,PIN 603202",CHENNAI,KANCHEEPURAM,TAMIL NADU,INDIAN BANK
IDIB000N145,18,NAROLI CHAUR,"GRAM PANCHAYAT, VILLAGE NAROLI CHAUR, OLD PANCHAYAT BUILDING, BAMANWAS TEH, SAWAI MADHOPUR DIST, RAJASTHAN, PIN - 322214",BAMANWAS,SAWAI MADHOPUR,RAJASTHAN,INDIAN BANK
IDIB000N146,18,NEW ADAJAN,"GANGESHWAR MAHADEV,MANDIR ROAD,ADAJAN,SURAT DIST,GUJARAT,PIN 395009",SURAT,SURAT,GUJARAT,INDIAN BANK
IDIB000N147,18,NARAYANAREDDIPETA,"KOTHAKALUVA CENTRE,NARAYANAREDDYPETA,NELLORE,ANDHRA PRADESH,PIN 524317",NARAYANA R PETA,NELLORE,ANDHRA PRADESH,INDIAN BANK
JAKA0FEROZE,34,FEROZPUR,"MALWAL ROAD OPP, H.M.SCHOOL","FEROZPUR, PUNJAB",FEROZPUR,PUNJAB,JAMMU AND KASHMIR BANK LIMITED
IDIB000N148,18,NARNAUL,"KHASRA NO 1359 WARD NO1 NARNAUL MAHENDERGARH ROAD, SHIV COLONY, NARNAUL, HARYANA, PIN-123001",NARNAUL,MAHENDRAGARH,HARYANA,INDIAN BANK
IDIB000N149,18,NAYAGAON,"MALLAWAN SANDILA ROAD, BILGRAM, NAYAGAON, HARDOI DIST, UP, PIN - 241303",MALLAWAN,HARDOI,UTTAR PRADESH,INDIAN BANK
IDIB000N150,18,NADALA,"DHILWAN ROAD, NADALA, KAPURTHALA DIST, PUNJAB, PIN-144624",NADALA,KAPURTHALA,PUNJAB,INDIAN BANK
IDIB000N151,18,NEMUR,"ANANTHAPURAM CROSS ROAD, NEMUR, VIKRAVANDI TALUK, VILLLUPURAM DIST, TAMIL NADU, PIN-605203",VIKRAVANDI,VILLUPURAM,TAMIL NADU,INDIAN BANK
IDIB000N152,18,NOLAMBUR,"NO.19/2, ANDAL AMMAL ST. RAJA GARDEN, NOLAMBUR, CHENNAI, TAMIL NADU, PIN-600095",MADURAVAYAL,THIRUVALLUR,TAMIL NADU,INDIAN BANK
IDIB000N153,18,NAMAKKAL TOWN,DOOR NO 2BY 209 OPPOSITE TO CITY UNION OFFICE PUDUCHATRAM DIST NAMMKAL,NAMAKKAL,NAMMAKAL,TAMIL NADU,INDIAN BANK
IDIB000N154,18,NILAKOTTAI,"6-2-36 B-3F, 3G, MADURAI MAIN ROAD, OPP BUS STAND, NILAKOTTAI, DINDIGUL DIST, TAMILNADU, PIN-624208",NILAKKOTTAI,DINDIGUL,TAMIL NADU,INDIAN BANK
IDIB000N155,18,NADUKOMBAI,"KOLLI HILLS MAIN ROAD, NADUKOMBAI , NAMAKKAL DIST, TAMILNADU, PIN-637404",KALAPPANAICKENPATTI,NAMAKKAL,TAMIL NADU,INDIAN BANK
IDIB000N156,18,NAWADA,"SITA RAM COMMERCIAL COMPLEX, OPP-ZILA PARISHAD AWAS & NARAD MUSEUM, MAIN ROAD, JAWAHAR NAGAR, NAWADA, BIHAR, PIN-805110",NAWADA,NAWADA,BIHAR,INDIAN BANK
IDIB000O001,18,ODUGATHUR,38/1 BUS ROAD ODUGATHUR VELLORE,ODUGATHUR,VELLORE,TAMIL NADU,INDIAN BANK
IDIB000O002,18,ONGOLE,"P.B. NO.11, RAVI COMPLEXTRUNK ROADONGOLE523001",ONGOLE,PRAKASAM,ANDHRA PRADESH,INDIAN BANK
IDIB000O004,18,OTTERI,"157 /1 B, STRAHANS ROAD OTTERI CHENNAI600012",CHENNAI,CHENNAI,TAMIL NADU,INDIAN BANK
IDIB000O005,18,OZHALUR,"26 GANDHI STREET, OZHALUR, KANCHEEPURAM DIST. PIN 603111",OZHALUR,KANCHEEPURAM,TAMIL NADU,INDIAN BANK
IDIB000O006,18,OLATPUR,OLATPUR BAIROI POST 754010,OLATPUR,CUTTAK,ODISHA,INDIAN BANK
IDIB000O007,18,OLAKKUR,81 PILLAIYUR KOIL STREET OLAKKUR VILLUPURAM 604305,OLAKKUR,VILLUPURAM,TAMIL NADU,INDIAN BANK
IDIB000O008,18,OMALUR,"DHARMAPURI MAIN ROAD, OMALUR, SALEM DIST.  PIN 636455",OMALUR,SALEM,TAMIL NADU,INDIAN BANK
IDIB000O009,18,OSMANGUNJ,"5-2-993/1,FIRST FLOOR NIZAMSHAHI ROADOSMANGUNJ 500195",HYDERABAD,HYDERABAD URBAN,ANDHRA PRADESH,INDIAN BANK
IDIB000O010,18,OCHERI,"446, BANGALORE TRUNK ROAD, OCHERI, VELLORE DIST. PIN 632531",OCHERI,VELLORE,TAMIL NADU,INDIAN BANK
IDIB000O011,18,OSHIWARA,"ACROPOLIS PLOT NO.LOKHANDWALA COMPLEX, OSHIWARA, ANDHERI WEST, MUMBAI 400053",MUMBAI,GREATER MUMBAI,MAHARASHTRA,INDIAN BANK
IDIB000O013,18,OOMACHIKULAM,150 NATHAM MAIN ROAD OOMACHIKULAM TIRUMALPURAM 625014,OOMACHIKULAM,MADURAI,TAMIL NADU,INDIAN BANK
IDIB000O014,18,OSB  CHENNAI,"2ND FLOOR, CREST BUILDING OLD NO 26/27, NEW NO 2, JEHANGIR STREET, CHENNAI , TAMILNADU, PIN 600001",CHENNAI,CHENNAI,TAMIL NADU,INDIAN BANK
IDIB000O016,18,OOMARABAD,MAIN ROAD OOMERABAD VELLORE 635808,OOMERABAD,VELLORE,TAMIL NADU,INDIAN BANK
IDIB000O017,18,ORATHANAD,16/25 MARIAMMAN KOIL STREET ORATHANADU 614625,ORATHANAD,THANJAVUR,TAMIL NADU,INDIAN BANK
IDIB000O018,18,OUPADA,MAIN ROAD OUPADA KENDRAPARA 754217,OUPADA,KENDRAPARA,ODISHA,INDIAN BANK
IDIB000O020,18,OKKUR,4/44-A MAIN ROAD OKKUR SIVAGANGAI 630557,OKKUR,SIVAGANGA,TAMIL NADU,INDIAN BANK
IDIB000O021,18,ODDANCHATRAM,A K M G COMPLEX P D MAIN ROAD ODDANCHATRAM 624619,ODDANCHATRAM,DINDIGUL,TAMIL NADU,INDIAN BANK
IDIB000O022,18,OSB  BANGALORE,"MANANDI PLAZA, NO.2 ST. MARKS ROAD, BANGALORE-560 001. PHONE NO..",BANGALORE,BANGALORE URBAN,KARNATAKA,INDIAN BANK
IDIB000O025,18,OTTAPPALAM,"OTTAPALAM MARKETING SOCIETY BLDG,TB ROAD,OTTAPALAM,",OTTAPALAM,PALAKKAD,KERALA,INDIAN BANK
IDIB000O026,18,ORAGADAM,ANNA STREETORAGADAMMATHUR POST  KANCHIPURAM TAMIL NADU-602105,MATHUR,KANCHEEPURAM,TAMIL NADU,INDIAN BANK
IDIB000O027,18,OTHAKKADAI,"MADURAI MELUR MAIN ROAD,OTHAKKADAI,MADURAI DIST,TAMIL NADU,PIN 625010",OTHAKKADAI,MADURAI,TAMIL NADU,INDIAN BANK
IDIB000O028,18,OLD HUBLI,"SAKUNTALA ARCADE, KASABAPET MAIN ROAD, OLD HUBLI, DHARWAR DIST, KARNATAKA, PIN-580024",HUBLI-DHARWAD,DHARWAD,KARNATAKA,INDIAN BANK
IDIB000O029,18,ORAI,"PRAKASH COMPLEX, OPP DISTRICT COURT, ORAI, JALAUN DIST, UP, PIN-285001",ORAI,JALAUN,UTTAR PRADESH,INDIAN BANK
IDIB000P001,18,PADI,69 M T H ROAD PADI 600050,CHENNAI,CHENNAI,TAMIL NADU,INDIAN BANK
IDIB000P003,18,PALACODE,109E FIRST FLOOR MAIN ROAD 636808,PALACODE,DHARMAPURI,TAMIL NADU,INDIAN BANK
IDIB000P004,18,PALAKOL,P B NO.2MAIN ROAD  PALAKOL WEST GODAVARI DIST.  ANDHRA PRADESH517408,PALAKOL,WEST GODAVARI,ANDHRA PRADESH,INDIAN BANK
IDIB000P005,18,P ALAGAPURI,101/1 BAZAAR STREET P ALGAPURI 630205,ALAGAPURI,PUDUKKOTTAI,TAMIL NADU,INDIAN BANK
IDIB000P006,18,PALAKKARAI,22 VAIKKALMETTU STREETPALAKARAITRICHY620001,TIRUCHIRAPPALLI,TIRUCHIORAPPALLI,TAMIL NADU,INDIAN BANK
IDIB000P007,18,PALAMANER,"12/57, JAVELI STREET  PALAMANER517408",PALAMANER,CHITTOR,ANDHRA PRADESH,INDIAN BANK
IDIB000P008,18,PALAYAMKOTTAI,"P B NO 39,84, THIRUVANANTHAPURAM ROAD,PALAYAMKOTTAI",PALAYAMKOTTAI,TIRUNELVALI,TAMIL NADU,INDIAN BANK
IDIB000P009,18,PALDI,"MUKHI CORNER P T COLLEGE CROSS ROAD, NARAYAN NAGAR ROAD, AHMEDABAD 380007",AHMEDABAD,AHMEDABAD,GUJARAT,INDIAN BANK
IDIB000P010,18,PALAKKAD,KEERTHI COMPLEX COURT ROAD PALAKAKD DT 678001,PALAKKAD,PALAKKAD,KERALA,INDIAN BANK
IDIB000P011,18,PALLATHUR (PM),130 O A STREET PALLATHUR SIVAGANGAI 630 107,PALLATHUR,SIVAGANGA,TAMIL NADU,INDIAN BANK
IDIB000P012,18,PALLAVARAM,5/115 BAJANAI KOILSTCONTONEMENTPALLAVARAM600043,CHENNAI,CHENNAI,TAMIL NADU,INDIAN BANK
IDIB000P013,18,PALLIPET,19 NAGARI ROAD PALLIPAT TIRUVALLUR 631207,PALLIPAT,TIRUVALLUR,TAMIL NADU,INDIAN BANK
IDIB000P014,18,PALANI,"P.B. NO.2, CONVENT ROAD PALANI DINDIGUL  624601",PALANI,DINDIGUL,TAMIL NADU,INDIAN BANK
