ifsc,bank_id,branch,address,city,district,state,bank_name
ICIC00CUCBL,8,THE CHANDGAD URBAN CO-OP BANK LIMITED,MAIN ROAD GURUVAR PETH CHANDGAD TAL CHANDGAD DIST KOLHAPUR - 416509,CHANDGAD,KOLHAPUR,MAHARASHTRA,ICICI BANK LIMITED
ICIC00DAUSA,8,DAUSA URBAN COOPERATIVE BANK,"NEW MANDI ROAD, DAUSA ┬û 303303,RAJASTHAN",DAUSA,DAUSA,RAJASTHAN,ICICI BANK LIMITED
ICIC00DCBCM,8,CHAMOLI ZILA SAHAKARI BANK LTD,"HEAD OFFICE GOPESHWAR , DIST CHAMOLI UTTRAKHAND PIN CODE -246401",GOPESHWAR CHAMOLI,CHAMOLI,UTTARAKHAND,ICICI BANK LIMITED
ICIC00DCBLS,8,DISTRICT COOPERATIVE BANK LTD  SAHARANPUR,"HEAD OFFICE, RAILWAY ROAD, SAHARANPUR ┬û 247001",SAHARANPUR,SAHARANPUR,UTTAR PRADESH,ICICI BANK LIMITED
ICIC00DDCBL,8,DISTRICT CO-OPERATIVE BANK  DEHRADUN,"DISTRICT CO-OPERATIVE BANK LTD. DEHADUN COURT CAMPUS DEHRADUN-248001,UTTARANCHAL",DEHRADUN,DEHRA DUN,UTTARAKHAND,ICICI BANK LIMITED
ICIC00DDNSB,8,DEENDAYAL NAGARI SAHAKARI BANK LTD,AMBAJOGAI DEENDAYAL BHAVAN PRASHANT NAGAR AMBAJOGAI 431517 DIST BEED,AMBAJOGAI,BID,MAHARASHTRA,ICICI BANK LIMITED
ICIC00DMKJA,8,DATTATRAYA MAHARAJ KALAMBE JAOLI SAHAKARI BANK LTD,"418/20, MAULANA AZAD ROAD, MUMBAI-400004",MUMBAI,GREATER BOMBAY,MAHARASHTRA,ICICI BANK LIMITED
ICIC00DMNSB,8,DWARKADAS MANTRI NAGARI SAH BANK,HEAD OFFICE JALNA ROAD BEED 431122,BHID,BID,MAHARASHTRA,ICICI BANK LIMITED
ICIC00DUCBL,8,DEVIKA URBAN CO-OPERATIVE BANK LTD,"P N DOGRA MARKET, UDHAMPUR (J & K) ┬û 182101",UDHAMPUR,UDHAMPUR,JAMMU AND KASHMIR,ICICI BANK LIMITED
ICIC00ETAWH,8,ETAWAH DISTRICT CO-OPERATIVE BANK LTD,"ETAWAH DISTRICT CO-OPERATIVE BANK LTD,  H.O., ETAWAH KUTCHERY ROAD, NAURANGABAD, ETAWAH ┬û 206001",ETAWAH,ETAWAH,UTTAR PRADESH,ICICI BANK LIMITED
ICIC00ETDCB,8,ETAH DISTRICT COOPERATIVE BANK LTD,"POST OFFICE CIVIL LINES, KUCTERY ROAD, ETAH 207001",ETAH,ETAH,UTTAR PRADESH,ICICI BANK LIMITED
ICIC00ETUCB,8,ETAH URBAN CO-OPERATIVE BANK,SHAH PALACE GANDHI MARKET ETAH -207001,ALIGANJ,ETAH,UTTAR PRADESH,ICICI BANK LIMITED
ICIC00FDCBL,8,THE DISTRICT COOPERATIVE BANK LTD  FARUKKHABAD,"OPP.RRC GROUND,KANPUR ROAD,FATEHGARH FARRUKHABAD ┬û 209601",FARRUKHABAD FATEHGARH,FARRUKHABAD,UTTAR PRADESH,ICICI BANK LIMITED
ICIC00FZSBL,8,FIROZABAD DISTRICT CENTRAL COOPERATIVE BANK LTD.,"H. O. COOPERATIVE BANK BUILDING, NH-2 P. O. - DABARI , NEAR C. M. O. OFFICE FIROZABAD -283203",FIROZABAD,FIROZABAD,UTTAR PRADESH,ICICI BANK LIMITED
ICIC00GAYAT,8,THE GAYATRI CO-OPERATIVE URBAN BANK LTD,"H. NO 7-1-72/73/74 GAYATHRI TOWERS, THAHASIL CHOWRASTA, JAGTIAL ┬û 505327, DIST KARIM NAGAR, A.P.",JAGTIAL,KARIMNAGAR,ANDHRA PRADESH,ICICI BANK LIMITED
ICIC00GDMCB,8,GANDHIDHAM COOPERATIVE BANK,GMCB BHAVAN PLOT NO 12 SECTOR 9 GANDHIDHAM 370201 KUTCH GUJARAT,GANDHIDHAM,KACHCHH,GUJARAT,ICICI BANK LIMITED
ICIC00GMCBL,8,THE GHOTI MERCHANTS CO-OP BANK LTD,"┬æBHAGYAVARDINI┬Æ, OLD AGRA ROAD, GHOTI ┬û 422402",GHOTI,NASIK,MAHARASHTRA,ICICI BANK LIMITED
ICIC00GNSBL,8,GAJANAN NAGARI SAHAKARI BANK LTD,SAGAR HIGHTS  OPP BUS STAND  BEED ? 431 122,BHID,BID,MAHARASHTRA,ICICI BANK LIMITED
ICIC00GOMTI,8,GOMTI NAGARIYA SAHAKARI BANK LTD,152 RUHATTA JAUNPUR UTTAR PRADESH,JAUNPUR,JAUNPUR,UTTAR PRADESH,ICICI BANK LIMITED
ICIC00GRNSB,8,GANRAJ NAGARI SAHAKARI BANK LTD,GALA NO 09 STADIUM COMPLEX JALNA ROAD BEED 431122,BHID,BID,MAHARASHTRA,ICICI BANK LIMITED
ICIC00GRSBL,8,SHRI GOVARDHANS RAGHUV SAH BK L NANDUR,763B TRIMURTHI SUBHASH CHOWK NANDURBAR MAHARASHTRA 425412,NANDURBAR,NANDURBAR,MAHARASHTRA,ICICI BANK LIMITED
ICIC00GUCCB,8,THE GADHINGLAJ URBAN COOPERATIVE BANK,AJARA-SANKESHWAR ROAD GADHINGLAJ,GADHINGLAJ,GADHINGLAJ,MAHARASHTRA,ICICI BANK LIMITED
ICIC00HDCCB,8,HAMIRPUR DISTRICT CO OPERATIVE BANK LTD MAHOBA,"RATH ROAD MAHOBA, DISTRICT-MAHOBA,(U.P) ┬û 210427",MAHOBA,MAHOBA,UTTAR PRADESH,ICICI BANK LIMITED
ICIC00HHSBL,8,HARIHARESHWAR SAHAKARI BANK LTD  WAI,"989, HARIHARESHWAR PLAZA, BRAMHANSHAHI, WAI ┬û 412803 , DIST ┬û SATARA",WAI,SATARA,MAHARASHTRA,ICICI BANK LIMITED
ICIC00HSBLW,8,HUTATMA SAHAKARI BANK LTD WALWA,B TYPE KARKHANA ROAD A P WALWA TAL WALWA DIST SANGLI,WALWA,SANGLI,MAHARASHTRA,ICICI BANK LIMITED
ICIC00IMSBL,8,INDIRA MAHILA SAHKARI BANK LTD,MALEGAON MAMLEDAR GALLI A BY P AND TAL MALEGAON 423203,MALEGAON,NASIK,MAHARASHTRA,ICICI BANK LIMITED
ICIC00INDPR,8,INDAPUR URBAN CO OP BANK LTD INDAPUR,APMC INDAPUR TALI NDAPUR DIST PUNE-413106,INDAPUR,PUNE,MAHARASHTRA,ICICI BANK LIMITED
ICIC00INPRS,8,INDORE PARASPAR SAHAKARI BANK LIMITED,"SAHAKAR SADAN, 221, TILAK PATH, INDORE 452 007",INDORE,INDORE,MADHYA PRADESH,ICICI BANK LIMITED
ICIC00IUCBL,8,INDAPUR URBAN CO OP BANK LTD,LTURE MARKET COMMITTEE CAMPUS PUNE SOLAPUR ROAD INDAPUR 413106 DIST PUNE,INDAPUR,PUNE,MAHARASHTRA,ICICI BANK LIMITED
ICIC00JCBLG,8,THE JANATA CO.OP. BANK LTD.GODHRA,"NAWA BAZAR, GODHRA-3890001",GODHRA,PANCH MAHALS,GUJARAT,ICICI BANK LIMITED
ICIC00JDCBL,8,JALAUN DISTRICT CO-OPERATIVE BANK LTD,JALAUN STATION RAOD ORAI ┬û 285001,JALAUN,JALAUN,UTTAR PRADESH,ICICI BANK LIMITED
ICIC00JDCCB,8,THE JALGAON DISTRICT CENTRAL CO-OPERATIVE BANK LTD,"HEAD OFFICE : 27, RING ROAD, JALGAON ┬û 425001",JALGAON,JALGAON,MAHARASHTRA,ICICI BANK LIMITED
ICIC00JPNSB,8,JAIPRAKASH NARAYAN NAGRI SAHAKARI BANK,"HPHVJHOWK,PBHNOD,BMHNGDHNGOL",HINGOLI,HINGOLI,MAHARASHTRA,ICICI BANK LIMITED
ICIC00JSBLA,8,JANTA SAHAKARI BANK LTD  AJARA,"MAIN ROAD, AJRA, DIST ┬û KOLHAPUR (MAHARASHTRA) ┬û 416505",AJRA,KOLHAPUR,MAHARASHTRA,ICICI BANK LIMITED
ICIC00JUCBL,8,JANSEWA URBAN CO-OP BANK LTD,1ST FLOOR MADHAVLEELA COMPLEX MASKASATH SQUARE ITWARI NAGPUR - 440002,NAGPUR,NAGPUR,MAHARASHTRA,ICICI BANK LIMITED
ICIC00JUCOB,8,JANTA URBAN CO-OP BANK,2408 B SONGIRWADI WAI-412803,SATARA,SATARA,MAHARASHTRA,ICICI BANK LIMITED
ICIC00JUSBL,8,JAYSINGPUR UDGAON SAHAKARI BANK LTD,"10TH LANE, SANGLI ┬û KOLHAPUR ROAD, OPP POLICE STATION, JAYSINGPUR ┬û 416101, TAL ┬û SHIROL, DIST ┬û KOLHAPUR",SHIROL,KOLHAPUR,MAHARASHTRA,ICICI BANK LIMITED
ICIC00KAIRA,8,THE KAIRA DISTRICT CENTRAL CO OP BANK LTD,"KDCC BANK BHAVAN, SARDAR PATEL ROAD, NADIAD. PIN- 387001 DIST: KHEDA GUJARAT",NADIAD,KHEDA,GUJARAT,ICICI BANK LIMITED
ICIC00KDCBL,8,KHARDAH COOPERATIVE BANK LIMITED,KHARDAH BRANCH NO.74 BY 24 BY 1 PK BISWAS ROAD KHARDAH KOLKATA 700117,KHARDAH,NORTH TWENTY FOUR PARGANAS,WEST BENGAL,ICICI BANK LIMITED
ICIC00KDUCB,8,KODOLI URBAN COOPERATIVE BANK,HO BRANCH KODAOLI AT POST KODOLI TAL PANHALA DIST KOLHAPUR,PANHALA,KOLHAPUR,MAHARASHTRA,ICICI BANK LIMITED
ICIC00KHIRI,8,DIST. COOP BANK LTD  LAKHIMPUR KHIRI,"CIVIL LINES, LAKHIMPUR KHIRI 262701",LAKHIMPUR KHERI,LAKHIMPUR KHERI,UTTAR PRADESH,ICICI BANK LIMITED
ICIC00KNSBL,8,KHALILABAD NAGAR SAHAKARI BANK LIMITED,"GOLA BAZAR, KHALILABAD,SHANT KABIR NAGAR, UTTAR PRADESH.272175.",KHALILABAD,SANT KABIR NAGAR,UTTAR PRADESH,ICICI BANK LIMITED
ICIC00KNUCB,8,KEDARNATH URBAN CO OP BANK LTD,AMBAJOGAI ROAD LATUR -413512,LATUR,LATUR,MAHARASHTRA,ICICI BANK LIMITED
ICIC00KPCBL,8,THE KHEDA PEOPLE'S CO.OP. BANK LTD,"PANIWALI SHERI, CHOKSI BAZAAR, KHEDA ┬û 387411",KHEDA,KHEDA,GUJARAT,ICICI BANK LIMITED
ICIC00KURLA,8,THE KURLA NAGARIK SAHAKARI BANK LTD,"210 S G BARVE MARG ,KURLA HIGH SCHOOL NEAR KURLA STATION KURLA [W]  MUMBAI 400070",MUMBAI,MUMBAI,MAHARASHTRA,ICICI BANK LIMITED
ICIC00KUTCB,8,KUTCH COOPERATIVE BANK LTD,SHEETAL 1ST FLOOR NEAR DIAMOND TALKIES L.T.ROAD BORIVLI W MUMBAI 400092,MUMBAI,GREATER BOMBAY,MAHARASHTRA,ICICI BANK LIMITED
ICIC00KZSBL,8,KANPUR ZILLA SAHAKARI BANK LTD,"30 D ,O ,BLOCK ALOO MANDI ,KIDWAI NAGAR ,KANPUR-208011",KANPUR,KANPUR CITY,UTTAR PRADESH,ICICI BANK LIMITED
ICIC00LDCBL,8,THE DISTRICT COOPERATIVE BANK LTD  LALITPUR,"NEAR ELITE CHORAHA, JHANSI ROAD, LALITPUR",LALITPUR,LALITPUR,UTTAR PRADESH,ICICI BANK LIMITED
ICIC00LKUCB,8,LAKHIMPUR URBAN COOP BANK LTD,CP102 RAJNAGAR YOJNA AWAS VIKAS COLONY KHERI ROAD LAKHIMPUR KHERI 262701,LAKHIMPUR,LAKHIMPUR KHERI,UTTAR PRADESH,ICICI BANK LIMITED
ICIC00LMNSB,8,LAXMIBAI MAHILA NAGARIK SAHAKARI BANK LTD,MOHAN NIWAS KAMPOO ROAD LASHKAR GWALIOR,GWALIOR,GWALIOR,MADHYA PRADESH,ICICI BANK LIMITED
ICIC00LUCBL,8,LAXMI URBAN CO OP BANK LTD,KAWA ROAD MARKET YARD LATUR 413512,LATUR,LATUR,MAHARASHTRA,ICICI BANK LIMITED
ICIC00MANUC,8,MANWATH URBAN COOP BANK,MAIN ROAD MANWAT DIST -PARBHANI 431505,MANWATH,PARBHANI,MAHARASHTRA,ICICI BANK LIMITED
ICIC00MAUCB,8,MAHESH URBAN CO OPERATIVE BANK LTD,KORE BUILDING TAILOR LANE TQ.PARLI VAIJNATH DIST BEED 431515,PARALI,BID,MAHARASHTRA,ICICI BANK LIMITED
ICIC00MCUBL,8,THE MANJERI COOP URBAN BANK LIMITED,MAIN BRANCH COURT ROAD MANJERI MALAPPURAM DISTRICT KERALA - 676121,MANJERI,MALAPPURAM,KERALA,ICICI BANK LIMITED
ICIC00MDCCB,8,THE DISTRICT COOPERATIVE BANK LTD  MAINPURI,"COURT ROAD, MAINPURI(U.P) ┬û 285001",MAINPURI,MAINPURI,UTTAR PRADESH,ICICI BANK LIMITED
ICIC00MDPPC,8,M.D. PAWAR PEOPLE┬ÆS CO-OPERATIVE BANK LIMITED,"H.O. MAHAVEER CHOWK, URUN-ISLAMPUR, 415409 , TALUK ┬û WALWA, DIST ┬û SANGLI",ISLAMPUR,SANGLI,MAHARASHTRA,ICICI BANK LIMITED
ICIC00MERUT,8,ZILA SAHKARI BANK LTD,"WESTERN KUTCHERY ROAD, MEERUT 25001",MEERUT,MEERUT,UTTAR PRADESH,ICICI BANK LIMITED
ICIC00MIRZA,8,ZILA SAHKARI BANK LTD,"PRADHAN KARYALAYA, COLLECTORATE COMPOUND,MIRZAPUR-231001",MIRZAPUR,MIRZAPUR,UTTAR PRADESH,ICICI BANK LIMITED
ICIC00MMCBL,8,THE MANMANDIR CO-OPERATIVE BANK LTD  VITA,"OPP S.T. STAND, VITA ┬û 415311, TALUKA ┬û KHANAPUR, DIST- SANGLI,MAHARASHTRA",VITA,SANGLI,MAHARASHTRA,ICICI BANK LIMITED
ICIC00MMNSB,8,MAHISHMATI NAGRIK SAHAKARI BANK,DR.AMBEDKAR WARD CHILMAN CHOWK MANDLA-481 661,MANDALA,MANDLA,MADHYA PRADESH,ICICI BANK LIMITED
ICIC00MNSBL,8,MARKANDEY NAGARI SAHAKARI BANK LTD,SHASTRI MARKET MAHATMA GANDHI ROAD 431604,NANDED,NANDED,MAHARASHTRA,ICICI BANK LIMITED
ICIC00MORAD,8,DISTRICT CO-OPERATIVE BANK,"NEAR BALAJI MANDIR,COURT ROAD, MORADABAD 244001",MORADABAD,MORADABAD,UTTAR PRADESH,ICICI BANK LIMITED
ICIC00MPCUB,8,MAHARANA PRATAP COOP URBAN BANK LTD,2-3-36/1  22 & 23  6 NO : X ROADS  BAGH AMBERPET  HYDERABAD -500013,HYDERABAD,HYDERABAD,ANDHRA PRADESH,ICICI BANK LIMITED
ICIC00MSCBL,8,THE MANIPUR STATE CO OP BANK LTD,ASSEMBLY ROAD IMPHAL 795001 MANIPUR,IMPHAL,IMPHAL,MANIPUR,ICICI BANK LIMITED
ICIC00MSMNB,8,MAA SHARDA MAHILA NAGRIK BANK,NEAR GHANTA GHAR KAMLA MARKET MAIHAR,MAIHAR,SATNA,MADHYA PRADESH,ICICI BANK LIMITED
ICIC00MUCBA,8,MAHESH URBAN COP BANK LTD AHMEDPUR,HEAD OFFICE COLLEGE ROAD AHMEDPUR DIST LATUR,AHMEDPUR,LATUR,MAHARASHTRA,ICICI BANK LIMITED
ICIC00MUCBL,8,MAHESH URBAN COOP BANK LTD,KORE BUILDING TAILAR LANE PARLIVAIJNATH TALUK PARLI VAIJANTH DIST BEED 431515,PARLIVAIJNATH,BID,MAHARASHTRA,ICICI BANK LIMITED
ICIC00MUPCB,8,THE MEHMADABAD URBAN PEOPLES CO-OPERATIVE BANK LTD,BANK ROAD BHAVSARVAD MAHEMDAVAD-387130 DIST.KHEDA GUJARAT,KHEDA,KHEDA,GUJARAT,ICICI BANK LIMITED
ICIC00MUZAF,8,ZILA SAHKARI BANK LTD,"COURT ROAD, MUZAFFARNAGAR 251001",MUZAFFARNAGAR,MUZAFFARNAGAR,UTTAR PRADESH,ICICI BANK LIMITED
ICIC00MZSBL,8,MATHURA ZILLA SAHAKARI BANK LTD.,"DAMPIER NAGAR NEAR BHAGAT SINGH PARK, MATHURA 281001",MATHURA,MATHURA,UTTAR PRADESH,ICICI BANK LIMITED
ICIC00NDCCB,8,THE NASIK DIST CENTRAL COOP BANK L,P NO 284  NDCC BANK MAIN BRANCH  SERVICE ROAD  AGRA ROAD  NEAR DWARKA CIRCLE NASIK ? 422011,NASHIK,NASIK,MAHARASHTRA,ICICI BANK LIMITED
ICIC00NDIMC,8,NASHIK DISTRICT INDUSTRIAL & MERCANTILE COOP BANK LTD,"SHIVKAMAL APARTMENT, CANADA CORNER, SHARANPUR EXTN ROAD, NASHIK ┬û 422005",NASHIK,NASIK,MAHARASHTRA,ICICI BANK LIMITED
ICIC00NGSBL,8,NISHIGANDHA SAHAKARI BANK LTD,"SHOPING CENTER,NR-GAJANAN MAHARAJ SANSTHAN,PANDHARPUR-413304,DIST SOLAPUR,MAHARASHTRA",PANDHARPUR,SOLAPUR,MAHARASHTRA,ICICI BANK LIMITED
ICIC00NIDHI,8,NIDHI CO-OP BANK LTD,"NIDHI HOUSE, N H ROAD ┬û 8, NR C.T.M., CHAR RASTA, AMRAIWADI, AHMEDABAD ┬û 380026",AHMEDABAD,AHMEDABAD,GUJARAT,ICICI BANK LIMITED
ICIC00NNCBL,8,NARODA NAGRIK COOP BANK LTD,NARODA BANK BHAVAN  GURUKUL-MEMNAGAR ROAD  AHMEDABAD ? 380052,MEMNAGAR,AHMADABAD,GUJARAT,ICICI BANK LIMITED
ICIC00NNSBL,8,NANDANI SAHAKARI BANK LTD,1224 BAZAR PETH NANDANI TAL.SHIROL DIST.KOLHAPUR,KOLHAPUR,KOLHAPUR,MAHARASHTRA,ICICI BANK LIMITED
ICIC00NVJVN,8,THE NAVJEEVAN COOP BANK LTD,"BHAVANI SAW MILL COMPOUND, ULHASNAGAR ┬û 421 003.",ULHASNAGAR,THANE,MAHARASHTRA,ICICI BANK LIMITED
ICIC00OJSBL,8,OMERGA JANTA SAHAKARI BANK LTD,MAIN ROAD OMERGA TALUKA OMERGA - 413606,OSMANABAD,OSMANABAD,MAHARASHTRA,ICICI BANK LIMITED
ICIC00PCUBL,8,THE PALAMOOR CO-OPERATIVE URBAN BANK LTD,"D. NO. 2-1-7/10A, 1ST FLOOR, WAQF COMPLEX, RAICHUR ROAD, MAHABUBNAGAR ┬û 509 001",MAHBUBNAGAR,MAHBUBNAGAR,ANDHRA PRADESH,ICICI BANK LIMITED
ICIC00PDCBL,8,PILIBHIT DISTRICT CO-OPERATIVE BANK LTD,REGIONAL OFIICE NEAR CHATARI CHAURAHA PILIBHIT-2627001,PILIBHIT,PILIBHIT,UTTAR PRADESH,ICICI BANK LIMITED
ICIC00PMCBL,8,THE PANDHARPUR  MERCHANTS CO-OP BANK LTD PANDHARPUR,"4075/A/1/39-LAXMI PATH,PANDHARPUR-413304,DIST SOLAPUR,MAHARASHTRA",PANDHARPUR,SOLAPUR,MAHARASHTRA,ICICI BANK LIMITED
ICIC00PPCOB,8,THE PIJ PEOPLES COOP BANK LTD,BANK BUILDING  MAIN BAZAR  TA- VASO  DIST ? KHEDA  AT POST PIJ ? 387230,VASO,KHEDA,GUJARAT,ICICI BANK LIMITED
ICIC00PRCBL,8,PRAGATHI CO-OPERATIVE BANK LTD,"NO. 12/1, PRAGATHI BHAVAN, 1ST MAIN ROAD, MALLESHWARAM, BANGALORE ┬û 560 003",BANGALORE,BANGALORE URBAN,KARNATAKA,ICICI BANK LIMITED
ICIC00PRDCB,8,THE DISTRICT COOPERATIVE BANK LTD  PRATAPGARGH,"RAJPAL TANKI , PRATAPGARH ,(UP) ┬û 230001",PRATAPGARH,PRATAPGARH,UTTAR PRADESH,ICICI BANK LIMITED
ICIC00PUCCB,8,THE PANDHARPUR URBAN COOP BANK LTD,4163B NAVI PETH PANDHARPUR 413304,PANDHARPUR,SOLAPUR,MAHARASHTRA,ICICI BANK LIMITED
ICIC00PURDC,8,THE PURNIA DISTRICT CENTRAL CO-OPERATIVE BANK LTD,COURT COMPOUND PURNIA SADAR PURNIA - 854301,PURNEA,PURNIA,BIHAR,ICICI BANK LIMITED
ICIC00PURVA,8,PURVANCHAL CO-OPERATIVE BANK LTD. GHAZIPUR,52A1 SHASTRI NAGAR LANKA GHAZIPUR U P PIN CODE 233001,GHAZIPUR,GHAZIPUR,UTTAR PRADESH,ICICI BANK LIMITED
ICIC00RAMPR,8,RAMPUR ZILA SAHAKARI BANK LTD,"CIVIL LINES, RAMPUR 244901",RAMPUR,RAMPUR,UTTAR PRADESH,ICICI BANK LIMITED
ICIC00RANPB,8,THE RANDER PEOPLES COOP BANK LTD,BANK BUILDING BOTAWALA MARG UMAD FALIA RANDER SURAT 395005,SURAT,SURAT,GUJARAT,ICICI BANK LIMITED
ICIC00RBDCB,8,RAE BARELI DISTRICT COOPERATIVE BANK LTD,"RAE BARELI COOP BANK BUILDING, IST FLOOR, H.P.O. KAIPERGANJ, GHANTAGHAR, KUTCHERY RD. RAE BARELI - 229 001",RAE BARELI,RAI BARELI,UTTAR PRADESH,ICICI BANK LIMITED
ICIC00RCCBL,8,THE RAJKOT COMMERCIAL CO-OPERATIVE BANK LTD,SUVIDHA CHANDULAL BUCH MARG RAJKOT 360001,RAJKOT,RAJKOT,GUJARAT,ICICI BANK LIMITED
ICIC00RUCBL,8,RAJAPUR URBAN COOP BANK LTD,NAVALE COMPLEX JAWAHAR CHOWK RAJAPUR DIST.RATNAGIRI 416 702,RAJAPUR,RATNAGIRI,MAHARASHTRA,ICICI BANK LIMITED
ICIC00RUMCO,8,THE RAIPUR URBAN MERCHANT CO-OP BANK LTD,RAVI BHAWAN JAISTAMBH CHOWK RAIPUR C.G.-492001,RAIPUR,RAIPUR,CHHATTISGARH,ICICI BANK LIMITED
ICIC00SAMSB,8,SAMATA SAHAKARI BANK LTD,SINGH SADAN KHOTWADI A.S.MARG OFF S V ROAD TPS VI SANTACRUZ W MUMBAI 400 054,MUMBAI,GREATER BOMBAY,MAHARASHTRA,ICICI BANK LIMITED
ICIC00SBCUB,8,THE SULTAN┬ÆS BATTERY CO-OPERATIVE URBAN BANK LTD,"CRESCENT BUILDING, SULTHAN BATHERY P.O. WAYANAD DISTRICT KERALA ┬û 673592",SULTHANBATHERY,WAYANAD,KERALA,ICICI BANK LIMITED
ICIC00SBSBN,8,SHRI BASAVESHWAR SAHAKARI BANK NYT  BAGALKOT,"BASAVESHWAR BANK CIRCLE, SECTOR NO. 25, NAVANAGAR, BAGALKOT - 587 103",BAGALKOT,BAGALKOTE,KARNATAKA,ICICI BANK LIMITED
ICIC00SBUCB,8,SHRI BALAJI URBAN CO-OPERATIVE BANK LTD,"1ST FLOOR, GANESH TOWER, JAISTAMBH CHOWK, SATNA ┬û 485001, M.P.",SATNA,SATNA,MADHYA PRADESH,ICICI BANK LIMITED
ICIC00SDCCB,8,THE SOLAPUR DISTRICT CENTRAL COOPERATIVE BANK LTD,"207,8,9 GOLD FINCH PETH SOLAPUR 413007",SOLAPUR,SOLAPUR,MAHARASHTRA,ICICI BANK LIMITED
ICIC00SEVUC,8,THE SEVALIA URBAN CO. OP BANK LTD,"SARDAR PATEL ROAD,  SEVALIA 388245",SEVALIA R.S.,KHEDA,GUJARAT,ICICI BANK LIMITED
ICIC00SHIDD,8,SHRI SHIDDHESHWAR COOPERATIVE BANK LTD,S S ROAD BIJAPUR KARNATAKA 586101,BIJAPUR,BIJAPUR,KARNATAKA,ICICI BANK LIMITED
ICIC00SHNSB,8,SHIVAJI NAGARI PAITHAN,TALUK PAITHAN 431107 DIST AURANGABAD,PAITHAN,AURANGABAD,MAHARASHTRA,ICICI BANK LIMITED
ICIC00SIDRH,8,URBAN COOP BANK LTD  SIDDHARTHANAGAR,"BANSI ROAD, PIPRI BAZAR, SIDDHARTHANAGAR, 272001",SIDHARTHANAGAR,SIDHARTHANAGAR,UTTAR PRADESH,ICICI BANK LIMITED
ICIC00SIDUC,8,SIDDHESHWAR URBAN CO-OP BANK MARYADIT SILLOD,PALODKAR BLD MAIN MARKET SILLOD DIST AURANGABAD PIN 431112,SILLOD,AURANGABAD,MAHARASHTRA,ICICI BANK LIMITED
ICIC00SJDCB,8,SHAHJAHANPUR DISTRICT CENTRAL CO-OPERATIVE BANK LTD.,"PRADHAN KARYALA, CIVIL LINES, NEAR KUCHHERY, SHAHJAHANPUR 242001",SHAHJAHANPUR,SHAHJAHANPUR,UTTAR PRADESH,ICICI BANK LIMITED
ICIC00SKSBN,8,SRI KALIDASA SAHAKARA BANK NIYAMITHA,"KURUBARA SANGHA BUILDING, 2ND MAIN, 2ND CROSS, GANDHINAGAR, BANGALORE ┬û 560 009",BANGALORE,BANGALORE URBAN,KARNATAKA,ICICI BANK LIMITED
ICIC00SMCUB,8,THE SECUNDERABAD MERCANTILE CO-OP URBAN BANK LTD,"1ST FLOOR, 2-4-52, M G ROAD, SECUNDERABAD, HYDERABAD ┬û 500003",SECUNDERABAD CANTONMENT,HYDERABAD,ANDHRA PRADESH,ICICI BANK LIMITED
ICIC00SMNSB,8,SANMITRA MAHILA NAGRI SAHAKARI BANK,2ND FLOOR KATYANI RUGNALAYA BALAJI WARD CHANDRAPUR 442401,CHANDRAPUR,CHANDRAPUR,MAHARASHTRA,ICICI BANK LIMITED
ICIC00SMRTH,8,SAMARTH SAHAKARI BANK LTD,"2 ANTROLIKAR SHOPPING CENTRE, DATTA CHOWK, SOLAPUR",SOLAPUR,SOLAPUR,MAHARASHTRA,ICICI BANK LIMITED
ICIC00SMSBL,8,SHRIMANT MALOJIRAJE SAHAKARI BANK LTD,"MUDHOJI MANMOHAN RAJWADA PARISAR, PHALTAN ┬û 415523 , DIST SATARA,MAHARASHTRA",PHALTAN,SATARA,MAHARASHTRA,ICICI BANK LIMITED
ICIC00SNSBL,8,THE SINOR NAGARIK SAHAKARI BANK LTD,AT & TA & PO - SINOR -391115  DIST ? BARODA  GUJARAT,SINOR,VADODARA,GUJARAT,ICICI BANK LIMITED
ICIC00SPCBL,8,THE SUVIKAS PEOPLE'S CO-OPERATIVE BANK LTD,"2ND FLOOR, SUN COMPLEX, NEAR STADIUM CIRCLE, C.G. ROAD, NAVRANGPURA, AHMEDABAD ┬û 380009,GUJRAT",AHMEDABAD,AHMADABAD,GUJARAT,ICICI BANK LIMITED
ICIC00SSBLI,8,SANMATI SAHAKARI BANK LTD ICHALKARANJI,"7-111, LAXMI MARKET,MAIN ROAD,JANTA CHAWK, ICHALKARNJI.416115.",ICHALKARANJI,KOLHAPUR,MAHARASHTRA,ICICI BANK LIMITED
ICIC00SUCBO,8,SAMARTH URBAN COOP BANK LTD,KALA MARUTI CHOWK MAIN ROAD OSMANABAD-413501,OSMANABAD,OSMANABAD,MAHARASHTRA,ICICI BANK LIMITED
ICIC00SULCB,8,SULAIMANI CO OP BANK LTD,RASULKHAN PATHAN ROAD MOGALWADA VADODARA 390017,VADODARA,VADODARA,GUJARAT,ICICI BANK LIMITED
ICIC00TAMCO,8,THE ANAND MERCANTILE CO-OP BANK,"MERCANTILE,MAHARSHI DAYANAND MARG,P B NO 38,ANAND 388001,GUJARAT",ANAND,ANAND,GUJARAT,ICICI BANK LIMITED
ICIC00TDMCB,8,THE DEOLA MERCHANTS COOP BANK LTD,"N 53-A51/19/1+2+3 UTTAM NAGAR CIDCO, C/O RAMDAS PLAZA, NEAR UTTAM NAGAR BUS STOP, NASHIK - 422009",NASHIK,NASIK,MAHARASHTRA,ICICI BANK LIMITED
ICIC00TECUB,8,THE ELURU URBAN COOP BANK LIMITED,D.NO.4 1 14 CANAL ROAD AGRAHARAM ELURU 534001,ELURU,WEST GODAVARI,ANDHRA PRADESH,ICICI BANK LIMITED
ICIC00TGZSB,8,TEHRI GARHWAL ZILA SAHAKARI BANK LTD,HEAD OFFICE : NEW TEHRI COUT CAMPUS TEHRI GARHWAL UTTARAKHAND,TEHRI,TEHRI GARHWAL,UTTARAKHAND,ICICI BANK LIMITED
ICIC00TJUCB,8,THE JAMKHANDI URBAN CO-OPERATIVE BANK LTD,UMARAMESHWAR ROAD JAMKHANDI-587301,AHMADNAGAR,AHMADNAGAR,MAHARASHTRA,ICICI BANK LIMITED
ICIC00TKNSB,8,THE KARJAN NAGARIK SAHAKARI BANK LTD,"OPP. NILKANTHESHVAR MAHADEV, NEAR HIGH SCHOOL, NAVA BAZAR, KARJAN ┬û 391240",KARJAN,VADODARA,GUJARAT,ICICI BANK LIMITED
ICIC00TMUCB,8,THE MAYANI URBAN COOP BANK LTD,"A/P MAYANI, TAL ┬û KHATAV, MAYANI ┬û 415102, DIST SATARA,",MAYANI,SATARA,MAHARASHTRA,ICICI BANK LIMITED
ICIC00TNSBL,8,TERNA NAGARI SAHAKARI BANK LTD. OSMANABAD,GORE COMPLEX SAMATA NAGAR OSMANABD PIN 413501,OSMANABAD,OSMANABAD,MAHARASHTRA,ICICI BANK LIMITED
ICIC00TPCBL,8,THASRA PEOPLES CO-OP.BANK LTD,"THASRA-388 250,DIST-KAIRA,GUJARAT.",THASRA,KHEDA,GUJARAT,ICICI BANK LIMITED
ICIC00TPUCB,8,THE PANCHKULA URBAN COOPERATIVE BANK LTD.,SCF NO-75 SECTOR 10 PANCHKULA,PANCHKULA,PANCHKULA,HARYANA,ICICI BANK LIMITED
ICIC00TPZCB,8,THE THODUPUZHA CO OP BANK LTD,"394, NEW BUILDING OPP SHRIKRISHANA TEMPLE THODUPUZHA.",IDIKKI,IDUKKI,KERALA,ICICI BANK LIMITED
ICIC00TSCBL,8,TRIPURA STATE CO-OPERATIVE BANK LIMITED,"POST OFFICE CHOWMOHANI, AGARTALA, PIN ┬û 799001",AGARTALA,WEST TRIPURA,TRIPURA,ICICI BANK LIMITED
ICIC00TSMCB,8,THE SATANA MERCHANTS COOP BANK LTD,DHANLAXMI TAHARABAD RD.SATANA NASHIK MAHARASHTRA - 423301,SATANA,NASIK,MAHARASHTRA,ICICI BANK LIMITED
ICIC00TTCBL,8,THE TIRUPATI CO-OPERATIVE BANK LIMITED,MAIN OFFICE 23 G.CAR STREET TIRUPATI AP,TIRUPATI,CHITTOOR,ANDHRA PRADESH,ICICI BANK LIMITED
ICIC00TUCBL,8,THE TIRUR URBAN CO-OPERATIVE BANK LTD,37/450 MANNAYIL ARCADE GOVT.HOSPITAL ROAD TRIKKANDIYUR TIRUR-676104 MALAPPURAM KERALA,TIROOR,MALAPPURAM,KERALA,ICICI BANK LIMITED
ICIC00TVCBL,8,THE VARDHMAN CO-OPERATIVE BANK LTD,"JAYLABH COMPLEX, CHANDI BAZAR, JAMNAGAR ┬û 361001",JAMNAGAR,JAMNAGAR,GUJARAT,ICICI BANK LIMITED
ICIC00TVSBL,8,THE VYANKATESHWARA SAHAKARI BANK LTD,10 167 TIRUPATI BUILDING 1ST FLOOR MAIN ROAD ICHALKARANJI,ICHALKARNJI,KOLHAPUR,MAHARASHTRA,ICICI BANK LIMITED
ICIC00TVUCB,8,THE VITA URBAN CO OP BANK LTD,A P- VITA TAL-KHANAPUR DIST SANGLI 415311,VITA,SANGLI,MAHARASHTRA,ICICI BANK LIMITED
ICIC00UCBLD,8,THE URBAN CO-OP BANK LTD,THE URBAN CO OP BANK LTD NEAR S T STAND DHARANGAON,DHARANGAON,JALGAON,MAHARASHTRA,ICICI BANK LIMITED
ICIC00UDCCB,8,THE DISTRICT COOPERATIVE BANK LTD  UNNAO,"DHAWAN ROAD UNNAO,(U.P) ┬û 209801",UNNAO,UNNAO,UTTAR PRADESH,ICICI BANK LIMITED
ICIC00UMUCB,8,UDAIPUR MAHILA URBAN CO-OP BANK LTD,"MAHAVIR BHAWAN, NEAR ASHWANI BAZAR, UDAIPUR RAJASTHAN -313001",UDAIPUR,UDAIPUR,RAJASTHAN,ICICI BANK LIMITED
ICIC00UPSCB,8,UTTAR PRADESH STATE COOPERATIVE BANK LTD,"2,MAHATMA GANDHI MARG LUCKNOW-226001,UTTAR PRADESH",LUCKNOW,LUCKNOW,UTTAR PRADESH,ICICI BANK LIMITED
ICIC00USCBD,8,UTTRAKHAND STATE CO-COPERATIVE BANK LTD,"4 VISHNU VIHAR AJABPUR KALAN BYPASS ROAD DEHRADUN,UTTARANCHAL",DEHRADUN,DEHRA DUN,UTTARAKHAND,ICICI BANK LIMITED
ICIC00USNDC,8,UDHAM SINGH NAGAR DISTRICT CO-OPERATIVE BANK LTD,"HOUSE NO. S.R.A-3, KASHIPUR BYPASS ROAD, RUDRAPUR, DIST ┬û UDHAM SINGH NAGAR",RUDRAPUR,UDHAM SINGH NAGAR,UTTARAKHAND,ICICI BANK LIMITED
ICIC00UUUCB,8,UDGIR URBAN COOP BANK,BANK STREET RAGA BUILDING UDGIR 413517,UDGIR,LATUR,MAHARASHTRA,ICICI BANK LIMITED
ICIC00VANSB,8,VAISHYA NAGARI,SARDAR PATEL ROAD KACCHI BAZAR PARBHANI 431401.,PARBHANI,PARBHANI,MAHARASHTRA,ICICI BANK LIMITED
ICIC00VBLTR,8,VIKAS COOPERATIVE BANK LTD,1ST FLOOR APANG SARATHI BUILDING JIVAN VIKAS PRATISHTHAN GANDHI MAIDAN LATUR 413512,LATUR,LATUR,MAHARASHTRA,ICICI BANK LIMITED
ICIC00VIKAS,8,VIKAS URBAN COOPERATIVE BANK NIYAMITHA,RAMANATH COMPLEX MAIN ROAD YELLAPUR ( U.K. ) -581359,YELLAPUR,UTTAR KANNAD,KARNATAKA,ICICI BANK LIMITED
ICIC00VMCBL,8,THE VITA MERCHANTS CO-OP BANK LTD,"YASHWANTNAGAR, SALSHINGE ROAD, VITA, DIST ┬û SANGLI (MAHARASHTRA) ┬û 416601",VITA,SANGLI,MAHARASHTRA,ICICI BANK LIMITED
ICIC00VMNSB,8,THE VALSAD MAHILA NAGRIK SAHAKARI BANK LTD,"MATRUPARAG,AZAD CHAWK,VALSAD,GUJARAT-3960001",VAPI,VALSAD,GUJARAT,ICICI BANK LIMITED
ICIC00VNSBL,8,VIVEKANAND NAGRIK SAHKARI BANK MARYADIT,"SHUJALPUR MANDI, NEAR POLICESTATION, SHUJALPUR ,DIST ┬û SHAJAPUR, PIN- 465333",SHUJALPUR,SHAJAPUR,MADHYA PRADESH,ICICI BANK LIMITED
ICIC00VSCBL,8,VIKAS SOUHARDA CO OPERATIVE BANK LTD,"OPP SRIRAMULU PARK, STATION ROAD, HOSEPT ┬û 583201",HOSPET,BELLARY,KARNATAKA,ICICI BANK LIMITED
ICIC00VUCBL,8,THE VAIDYANATH URBAN CO-OP BANK LTD,"H.O. MONDHA, PARLI-VAIJNATH, DIST BEED, PIN ┬û 431515, MAHARASHTRA",PARLI-VAIJNATH,BID,MAHARASHTRA,ICICI BANK LIMITED
ICIC00WUCBL,8,WARANGAL URBAN COOP BANK LIMITED,H.NO.11 15 107 1ST FLOOR O CITY ROAD KASHIBUGGA WARANGAL 506002,WARANGAL,WARANGAL,TELANGANA,ICICI BANK LIMITED
ICIC00ZSBBU,8,ZILA SAHKARI BANK LTD BUDAUN,SAHAKARI BANK BHAWAN FIRST FLOOR STATION ROAD CIVIL LINE BUDAUN 243601,BADAUN,BUDAUN,UTTAR PRADESH,ICICI BANK LIMITED
ICIC00ZSBHA,8,ZILA SAHAKARI BANK LTD  HARIDWAR,"ZILA SAHAKARI BANK LIMITED HARIDWAR, H.O.- B.T. GANJ ROORKEE,DISTT HARIDWAR(UTTARAKHAND)-247667",ROORKEE,HARIDWAR,UTTARAKHAND,ICICI BANK LIMITED
ICIC00ZSBLB,8,ZILA SAHAKARI BANK LTD  BAREILLY,"ICICI BANK LTD.,H.O., SHAHJAHANPUR ROAD, NEAR MADHUBAN TALKIES, BAREILLY 243005",BAREILLY,BAREILLY,UTTAR PRADESH,ICICI BANK LIMITED
ICIC00ZSBLJ,8,ZILA SAHKARI BANK LTD  JHANSI,156/1 CIVIL LINES JHANSI (U.P) -  284001,JHANSI,JHANSI,UTTAR PRADESH,ICICI BANK LIMITED
ICIC00ZSBLL,8,ZILA SAHKARI BANK LTD LUCKNOW,JAGDISH BUILDING HAZRATGANJ LUCKNOW 226001,LUCKNOW,LUCKNOW,UTTAR PRADESH,ICICI BANK LIMITED
ICIC00ZSKTW,8,ZILA SAHAKARI BANK LTD  GARHWAL (KOTDWARA),"MAIN BRANCH BADRINATH MARG, KOTDWARA, UTTARAKHAND-246149",KOTDWARA,GARHWAL,UTTARAKHAND,ICICI BANK LIMITED
ICIC00ZSMAU,8,ZILA SAHAKARI BANK LTD MAU,"ZILA SAHAKARI BANK LTD,  275, INDIRA COMPLEX, 2ND FLOOR, SAHADATPURA, MAU ┬û 275001",SAHADATPURA,MAU,UTTAR PRADESH,ICICI BANK LIMITED
ICIC0SF0002,8,CMS,"ICICI BANK TOWERS, BANDRA KURLA COMPLEX, BANDRA E,MUMBAI-400051",MUMBAI,GREATER BOMBAY,MAHARASHTRA,ICICI BANK LIMITED
ICIC0TREA00,8,RTGS-HO,"ICICI BANK TOWERS, BANDRA KURLA COMPLEX, MUMBAI 400051",MUMBAI,GREATER BOMBAY,MAHARASHTRA,ICICI BANK LIMITED
IDFB0010201,104,INTERNET BANKINGCPU,"IDFC BANK LTD.8TH FLOOR,BUILDING NO.1,AIROLI WEST GIGAPLEX,LANDMARKOPPOSITE IGATE,PLOT NO.IT5,MIDC KNOWLEDGE CORRIDOR,AIROLI,NAVI MUMBAI 400708",THANE,THANE,MAHARASHTRA,IDFC BANK LIMITED
IDFB0010202,104,TREASURY CPU,8TH FLOOR NAMAN CHAMBERS C32 GBLOCK BANDRAKURLA COMPLEX BANDRA EASTMUMBAI 400051,MUMBAI,MUMBAI,MAHARASHTRA,IDFC BANK LIMITED
IDFB0010204,104,CMS HUB,"IDFC BANK LTD.7TH FLOOR,BUILDING NO.1,AIROLI WEST GIGAPLEX,LANDMARKOPPOSITE IGATE,PLOT NO.IT5,MIDC KNOWLEDGE CORRIDOR,AIROLI,NAVI MUMBAI 400708",THANE,THANE,MAHARASHTRA,IDFC BANK LIMITED
IDFB0010205,104,TRADE FINANCE CPUTI,"IDFC BANK LTD.7TH FLOOR,BUILDING NO.1,AIROLI WEST GIGAPLEX,LANDMARKOPPOSITE IGATE,PLOT NO.IT5,MIDC KNOWLEDGE CORRIDOR,AIROLI,NAVI MUMBAI 400708",THANE,THANE,MAHARASHTRA,IDFC BANK LIMITED
IDFB0010206,104,RURAL CPU NOVA,"IDFC BANK LTD.7TH FLOOR,BUILDING NO.1,AIROLI WEST GIGAPLEX,LANDMARKOPPOSITE IGATE,PLOT NO.IT5,MIDC KNOWLEDGE CORRIDOR,AIROLI,NAVI MUMBAI 400708",THANE,THANE,MAHARASHTRA,IDFC BANK LIMITED
IDFB0010207,104,WHOLESALE CPUBSMART,"IDFC BANK LTD.8TH FLOOR,BUILDING NO.1,AIROLI WEST GIGAPLEX,LANDMARKOPPOSITE IGATE,PLOT NO.IT5,MIDC KNOWLEDGE CORRIDOR,AIROLI,NAVI MUMBAI 400708",THANE,THANE,MAHARASHTRA,IDFC BANK LIMITED
